Категория;Наименование товара;Стоимость, руб
Томат;Томат Кемеровец/Сем Алт/цп 0,05 гр. Сибирская Селекция!;24
Томат;Томат Китайский Болезнеустойчивый/Сем Алт/цп 0,05 гр. АЗИАТСКИЙ ОГОРОД!;28
Томат;Томат Китайский Болезнеустойчивый/Сем Алт/цп 0,1 гр. КИТАЙСКАЯ СЕРИЯ;21
Томат;Томат Китайский Жароустойчивый/Сем Алт/цп 0,05 гр. АЗИАТСКИЙ ОГОРОД!;33
Томат;Томат Китайский Ранний/Сем Алт/цп 0,05 гр. АЗИАТСКИЙ ОГОРОД!;29
Томат;Томат Китайский Розовый/Сем Алт/цп 0,05гр. АЗИАТСКИЙ ОГОРОД!;24
Томат;Томат Китайский Розовый/Сем Алт/цп 0,1 гр. КИТАЙСКАЯ СЕРИЯ;18
Томат;Томат Китайский Холодоустойчивый/Сем Алт/цп 0,05 гр. АЗИАТСКИЙ ОГОРОД!;33
Томат;Томат Китайский Холодоустойчивый/Сем Алт/цп 0,1 гр. КИТАЙСКАЯ СЕРИЯ;34
Томат;Томат Кнопа/Сем Алт/цп 5 шт.;77
Томат;Томат Комбат/Сем Алт/цп 0,05 гр. Наша Селекция!;36
Томат;Томат Комнатный Сибиряк/Сем Алт/цп 0,05 гр. УРОЖАЙ НА ОКНЕ!;32
Томат;Томат Королевич/Сем Алт/цп 0,05 гр. Наша Селекция!;44
Томат;Томат Король Крупных/Сем Алт/цп 0,05 гр, Наша Селекция!;41
Томат;Томат Король Лондона/Сем Алт/цп 0,05 гр.;33
Томат;Томат Король Ранних/Сем Алт/цп 0,05 гр. Наша Селекция!;29
Томат;Томат Король Сибири/Сем Алт/цп 0,05 гр. Наша Селекция!;39
Томат;Томат Красногвардеец/Сем Алт/цп 0,05 гр. Наша Селекция!;35
Томат;Томат Кулема Алтайская/Сем Алт/цп 0,05 гр. Наша Селекция! ®;56
Томат;Томат Лампочка/Сем Алт/цп 0,05 гр.;33
Томат;Томат Лонг Кипер/Сем Алт/цп 0,05 гр.;29
Томат;Томат Лось F1/Сем Алт/цп 3 шт.;116
Томат;Томат Любимый Король/Сем Алт/цп 0,05 гр. Наша Селекция!;32
Томат;Томат Любовь F1/Сем Алт/цп 10 шт.;36
Томат;Томат Любовь F1/Сем Алт/цп 15 шт.;36
Томат;Томат Ляна/Сем Алт/цп 0,1 гр.;29
Томат;Томат Малиновый Звон/Сем Алт/цп 10 шт.;34
Томат;Томат Малиновый Звон/Сем Алт/цп 15 шт.;41
Томат;Томат Мамонтенок/Сем Алт/цп 5 шт.;64
Томат;Томат Маняша/Сем Алт/цп 0,05 гр. Наша Селекция!;34
Томат;Томат Марал F1/Сем Алт/цп 10 шт. НОВИНКА!;79
Томат;Томат Марочка/Сем Алт/цп 0,05 гр. НОВИНКА!;50
Томат;Томат Медовый вкус/Сем Алт/цп 0,05 гр.;29
Томат;Томат Метелица/Сем Алт/цп 0,05 гр. Сибирская Селекция!;29
Томат;Томат Могучее Вымя/Сем Алт/цп 0,05 гр.;52
Томат;Томат Молодчина/Сем Алт/цп 0,05 гр. Наша Селекция!;34
Томат;Томат Монеточка/Сем Алт/цп 0,05 гр.;49
Томат;Томат Мохнатый Шмель/Сем Алт/цп 0,05 гр. Наша Селекция!;36
Томат;Томат Надежда F1/Сем Алт/цп 15 шт.;38
Томат;Томат Настёна F1/Сем Алт/цп 10 шт.;41
Томат;Томат Настенька/Сем Алт/цп 0,05 гр. Наша Селекция!;59
Томат;Томат Никитка/Сем Алт/цп 0,05 гр. Наша Селекция!;32
Томат;Томат Никола/Сем Алт/цп 0,05 гр. Сибирская Селекция!;27
Томат;Томат Новинка Приднестровья/Сем Алт/цп 0,1 гр.;21
Томат;Томат Огородный Колдун/Сем Алт/цп 0,05 гр. Наша Селекция!;32
Томат;Томат Ожерелье Желтое/Сем Алт/цп 0,05 гр. Наша Селекция!;29
Томат;Томат Ожерелье Красное/Сем Алт/цп 0,05 гр. Наша Селекция!;29
Томат;Томат Ожерелье Смесь/Сем Алт/цп 0,05 гр. НОВИНКА!;29
Томат;Томат Олеся/Сем Алт/цп 0,05 гр. Сибирская Селекция!;29
Томат;Томат Оранжевое Лето/Сем Алт/цп 0,05 гр. Наша Селекция!;29
Томат;Томат Патрикеевна/Сем Алт/цп 0,05  гр. Наша Селекция!;32
Томат;Томат Пень F1/Сем Алт/цп 5 шт.;131
Томат;Томат Перцевидный/Сем Алт/цп 0,05 гр.;29
Томат;Томат Пикет/Сем Алт/цп 0,05 гр. Сибирская Селекция!;23
Томат;Томат Президент 2 F1/Сем Алт/цп 5 шт. Seminis (Голландские Семена);101
Томат;Томат Примадонна F1/Сем Алт/цп 10 шт.;56
Томат;Томат Примадонна F1/Сем Алт/цп 15 шт.;59
Томат;Томат Пухляш F1/Cем Алт/цп 5 шт. НОВИНКА!;110
Томат;Томат Пылающее Сердце/Сем Алт/цп 0,05 гр. Наша Селекция!;32
Томат;Томат Ракета (Красная)/Сем Алт/цп 0,05 гр.;29
Томат;Томат Ранний - 83/Сем Алт/цп 0,05 гр.;27
Томат;Томат Ранний - 83/Сем Алт/цп 0,1 гр.;28
Томат;Томат Ранняя Любовь/Сем Алт/цп 0,05 гр. Наша Селекция!;29
Томат;Томат Розовое Сердце/Сем Алт/цп 0,1 гр.;29
Томат;Томат Розовый Гигант/Сем Алт/цп 0,05 гр.;27
Томат;Томат Розовый Гигант/Сем Алт/цп 0,1 гр.;29
Томат;Томат Розовый Слон/Сем Алт/цп 0,05 гр.;32
Томат;Томат Самородок/Сем Алт/цп 0,05 гр. Наша Селекция!;32
Томат;Томат Санька/Сем Алт/цп 0,05 гр.;29
Томат;Томат Свит Черри Смесь/Сем Алт/цп 0,05 гр.;29
Томат;Томат Севрюга/Сем Алт/цп 0,05 гр. Сибирская Селекция!;32
Томат;Томат Семен Безголовый/Сем Алт/цп 0,05 гр. Сибирская Селекция!;32
Томат;Томат Сердцеедка Алтайская/Сем Алт/цп 5 шт. Наша Селекция!;64
Томат;Томат Сибирская Корона/Сем Алт/цп 0,05 гр.;29
Томат;Томат Сибирские Черри/Сем Алт/цп 0,05 гр.;29
Томат;Томат Сибирский Гигант Желтый/Сем Алт/цп 0,05 гр. СЕРИЯ СИБИРСКИЕ ГИГАНТЫ!;41
Томат;Томат Сибирский Здоровяк/Сем Алт/цп 0,05 гр. СЕРИЯ ЧЕМПИОНЫ ПОЛЬЗЫ!;41
Томат;Томат Сибирский Крепыш/Сем Алт/цп 0,05 гр. НОВИНКА!;29
Томат;Томат Сибирский Пируэт/Сем Алт/цп 0,05 гр. Наша Селекция!;32
Томат;Томат Сибирский Скороспелый/Сем Алт/цп 0,1 гр. Сибирская Селекция!;28
Томат;Томат Сибирячок/Сем Алт/цп 0,05 гр. Наша Селекция!;25
Томат;Томат Славянин/Сем Алт/цп 0,05 гр. Сибирская Селекция!;27
Томат;Томат Сладкая Гроздь/Сем Алт/цп 0,05 гр.;29
Томат;Томат Сладкий Шар/Сем Алт/цп 0,05 гр. Наша Селекция!;24
Томат;Томат Сладкое Дерево/Сем Алт/цп 0,05 гр.;29
Томат;Томат Сливка Желтая/Сем Алт/цп 0,05 гр. Наша Селекция!;29
Томат;Томат Сливка Красная/Сем Алт/цп 0,05 гр. Наша Селекция!;29
Томат;Томат Снегири/Сем Алт/цп 0,05 гр.;29
Томат;Томат Снежана/Сем Алт/цп 0,05 гр. Сибирская Селекция!;29
Томат;Томат Сольный Номер/Сем Алт/цп 0,05 гр. Наша Селекция!;32
Томат;Томат Спиридон/Сем Алт/цп 0,05 гр. Сибирская Селекция!;27
Томат;Томат Стерлядь F1/Сем Алт/цп 5 шт.;71
Томат;Томат Толстый Боцман/Сем Алт/цп 0,05 гр. Сибирская Селекция!;36
Томат;Томат Топ-Модель/Сем Алт/цп 0,05 гр. Наша Селекция!;29
Томат;Томат Точка/Сем Алт/цп 0,05 гр. НОВИНКА!;50
Томат;Томат Трюфель Желтый/Сем Алт/цп 0,05 гр.;29
Томат;Томат Трюфель Красный/Сем Алт/цп 0,05 гр.;29
Томат;Томат Феня F1/Cем Алт/цп 10 шт. НОВИНКА!;74
Томат;Томат Фиеста F1/Сем Алт/цп 0,05 гр. Сибирская Селекция!;29
Томат;Томат Флорида 47 Р F1/Сем Алт/цп 10 шт. Seminis (Голландские Семена);66
Томат;Томат Хурма/Сем Алт/цп 0,05 гр.;29
Томат;Томат Царевич/Сем Алт/цп 0,05 гр. Наша Селекция!;34
Томат;Томат Цыпочка/Сем Алт/цп 10 шт. НОВИНКА!;56
Томат;Томат Челнок/Сем Алт/цп 0,05 гр.;26
Томат;Томат Челнок/Сем Алт/цп 0,1 гр.;23
Томат;Томат Черный Мавр/Сем Алт/цп 0,05 гр.;29
Томат;Томат Черри-Мини/Сем Алт/цп 0,05 гр.;29
Томат;Томат Чудо Алтая/Сем Алт/цп 0,05 гр. Наша Селекция!;36
Томат;Томат Шакира F1/Сем Алт/цп 5 шт. Seminis (Голландские Семена);121
Томат;Томат Шедевр/Сем Алт/цп 0,05 гр.;28
Томат;Томат Шоколадный/Сем Алт/цп 0,05 гр.;29
Томат;Томат Штамбовый Крупноплодный/Сем Алт/цп 0,05 гр.;29
Томат;Томат Шурочка/Сем Алт/цп 0,05 гр. НОВИНКА!;50
Томат;Томат Яблочный/Сем Алт/цп 0,05 гр.;16
Томат;Томат Ямал/Сем Алт/цп 0,05 гр.;29
Томат;Томат Янтарный Мед/Сем Алт/цп 0,05 гр.;29
Томат;Томат Янтарный Мед/Сем Алт/цп 0,1 гр.;24
Тыква;Тыква Важная Госпожа/Сем Алт/цп 1 гр.;32
Тыква;Тыква Волжская Серая 92/Сем Алт/цп 2 гр.;18
Тыква;Тыква Голосемянная/Сем Алт/цп 5 шт.;29
Тыква;Тыква Грибовская Зимняя/Сем Алт/цп 2 гр.;20
Тыква;Тыква Грибовская Кустовая 189/Сем Алт/цп 1 гр.;24
Тыква;Тыква Дама в Шляпе/Сем Алт/цп 1 гр.;34
Тыква;Тыква Жемчужина Мускатная/Сем Алт/цп 2 гр.;29
Тыква;Тыква Зимняя сладкая/Сем Алт/цп 2 гр.;19
Тыква;Тыква Карета для Золушки/Сем Алт/цп 2 гр.;22
Тыква;Тыква китайская Фонарик/Сем Алт/цп 1 гр. АЗИАТСКИЙ ОГОРОД!;29
Тыква;Тыква Кладовая Здоровья/Сем Алт/цп 1 гр. СЕРИЯ ЧЕМПИОНЫ ПОЛЬЗЫ!;31
Тыква;Тыква Крошка/Сем Алт/цп 2 гр.;26
Тыква;Тыква Лакомый Кусочек/Сем Алт/цп 1 гр.;26
Тыква;Тыква Лечебная/Сем Алт/цп 2 гр.;22
Тыква;Тыква Мама не Горюй/Сем Алт/цп 1 гр.;30
Тыква;Тыква Медовая Каша/Сем Алт/цп 1 гр.;28
Тыква;Тыква Мраморная/Сем Алт/цп 2 гр.;19
Тыква;Тыква Мулен Руж/Сем Алт/цп 1 гр.;29
Тыква;Тыква мускатная Витаминная/Сем Алт/цп 2 гр.;26
Тыква;Тыква Пампушка/Сем Алт/цп 2 гр.;24
Тыква;Тыква Радужная/Сем Алт/цп 1 гр.;26
Тыква;Тыква Розовый Банан/Сем Алт/цп 1 гр. НОВИНКА!;39
Тыква;Тыква Россиянка/Сем Алт/цп 2 гр.;29
Тыква;Тыква Сибирский Гигант/Сем Алт/цп 2 гр. СЕРИЯ СИБИРСКИЕ ГИГАНТЫ!;29
Тыква;Тыква Стофунтовая/Сем Алт/цп 2 гр.;29
Тыква;Тыква Тортилла/Сем Алт/цп 1 гр. НОВИНКА!;41
Тыква;Тыква Улыбка/Сем Алт/цп 2 гр.;26
Фасоль;Фасоль Ассоль/Сем Алт/цп 5 гр.;29
Фасоль;Фасоль Бона/Сем Алт/цп 5 гр.;29
Фасоль;Фасоль Бриллиант/Сем Алт/цп 5 гр.;29
Фасоль;Фасоль День и ночь/Сем Алт/цп 5 гр. НОВИНКА!;32
Фасоль;Фасоль Журавушка/Сем Алт/цп 5 гр.;29
Фасоль;Фасоль Капучино/Сем Алт/цп 5 гр. НОВИНКА!;29
Фасоль;Фасоль Красная Шапочка/Сем Алт/цп 5 гр.;29
Фасоль;Фасоль Курочка Ряба/Сем Алт/цп 5 гр.;29
Фасоль;Фасоль Лима/Сем Алт/цп 5 гр.;29
Фасоль;Фасоль Лобио/Сем Алт/цп 5 гр.;27
Фасоль;Фасоль Московская Белая Зеленостручная 556/Сем Алт/цп 5 гр.;29
Фасоль;Фасоль Пеппи Длинный Чулок/Сем Алт/цп 5 гр.;27
Фасоль;Фасоль Пинто/Сем Алт/цп 5 гр. НОВИНКА!;29
Фасоль;Фасоль Рубин/Сем Алт/цп 5 гр.;29
Фасоль;Фасоль Эксалто/Сем Алт/цп 5 гр.;29
Экзотика;Экзотика Бамия (Окра) Дамские Пальчики/Сем Алт/цп 0,5 гр.;25
Экзотика;Экзотика Кивано Зеленый дракон/Сем Алт/цп 5 шт. АЗИАТСКИЙ ОГОРОД!;48
Экзотика;Экзотика Момордика Найя/Сем Алт/цп 4 шт. АЗИАТСКИЙ ОГОРОД!;50
Экзотика;Экзотика Момордика Экзотическая смесь/Сем Алт/цп 4 шт. АЗИАТСКИЙ ОГОРОД!;55
Экзотика;Экзотика Пепино (Дынная Груша)/Сем Алт/цп 5 шт.;124
Экзотика;Экзотика Тортарелло Абруззе (Армянский Огурец)/Сем Алт/цп 0,3 гр.;29
Экзотика;Экзотика Тортарелло Бареззе (Армянский Огурец)/Сем Алт/цп 0,3 гр.;29
Ягода;Физалис Конфитюр овощной/Сем Алт/цп 0,2 гр.;29
Ягода;Физалис Мармелад/Сем Алт/цп 0,2 гр. НОВИНКА!;27
Ягода;Физалис Медовая Сливка/Сем Алт/цп 0,2 гр. НОВИНКА!;27
Ягода;Ягода Ежевика Блэк Мама крупноплодная/Сем Алт/цп 0,03 гр. НОВИНКА;36
Ягода;Ягода Земляника Александрия ремонтантная/Сем Алт/цп 0,03 гр.;29
Ягода;Ягода Земляника Али-Баба ремонтантная/Сем Алт/цп 0,03 гр.;32
Ягода;Ягода Земляника Атилла ремонтантная/Сем Алт/цп 0,03 гр. НОВИНКА;44
Ягода;Ягода Земляника Барон Солемахер ремонтантная/Сем Алт/цп 0,03 гр.;35
Ягода;Ягода Земляника Желтое чудо ремонтантная/Сем Алт/цп 0,1 гр.;33
Ягода;Ягода Земляника Крем-брюле желтая ремонтантная/Сем Алт/цп 0,03 гр. НОВИНКА;29
Ягода;Ягода Земляника Мигнонетт ремонтантная/Сем Алт/цп 5 шт. НОВИНКА;34
Ягода;Ягода Земляника Монако ремонтантная крупноплодная/Сем Алт/цп 0,01 гр. НОВИНКА;45
Ягода;Ягода Земляника Полянка ремонтантная/Сем Алт/цп 0,02 гр. НОВИНКА;29
Ягода;Ягода Земляника Регина ремонтантная/Сем Алт/цп 0,03 гр.;36
Ягода;Ягода Земляника Рюген ремонтантная/Сем Алт/цп 0,03 гр. НОВИНКА;39
Ягода;Ягода Земляника Фреска ремонтантная/Сем Алт/цп 5 шт. НОВИНКА;89
Ягода;Ягода Малина Барнаулка красная/Сем Алт/цп 0,03 гр. НОВИНКА;36
Ягода;Ягода Малина Чарыш желтая/Сем Алт/цп 0,03 гр. НОВИНКА;36
"Серия ""Сибирский гигант""";Горох Сибирский Гигант/Сем Алт/цп 10 гр. СЕРИЯ СИБИРСКИЕ ГИГАНТЫ!;41
"Серия ""Сибирский гигант""";Дайкон Сибирский Гигант/Сем Алт/цп 1 гр. СЕРИЯ СИБИРСКИЕ ГИГАНТЫ!;30
"Серия ""Сибирский гигант""";Лук Порей Сибирский Гигант/Сем Алт/цп 1 гр. СЕРИЯ СИБИРСКИЕ ГИГАНТЫ!;37
"Серия ""Сибирский гигант""";Лук Сибирский Гигант/Сем Алт/цп 0,2 гр. НОВИНКА! СЕРИЯ СИБИРСКИЕ ГИГАНТЫ!;34
"Серия ""Сибирский гигант""";Огурец Сибирский Гигант F1/Сем Алт/цп 10 шт. СЕРИЯ СИБИРСКИЕ ГИГАНТЫ!;34
"Серия ""Сибирский гигант""";Перец Сибирский Богатырь/Сем Алт/цп 0,1 гр. СЕРИЯ ЧЕМПИОНЫ ПОЛЬЗЫ!;44
"Серия ""Сибирский гигант""";Перец Сибирский Гигант F1/Сем Алт/цп 5 шт.;104
"Серия ""Сибирский гигант""";Редис Сибирский Гигант/Сем Алт/цп 2 гр. СЕРИЯ СИБИРСКИЕ ГИГАНТЫ!;29
"Серия ""Сибирский гигант""";Томат Сибирский Гигант Желтый/Сем Алт/цп 0,05 гр. СЕРИЯ СИБИРСКИЕ ГИГАНТЫ!;41
"Серия ""Сибирский гигант""";Томат Сибирский Здоровяк/Сем Алт/цп 0,05 гр. СЕРИЯ ЧЕМПИОНЫ ПОЛЬЗЫ!;41
"Серия ""Сибирский гигант""";Тыква Сибирский Гигант/Сем Алт/цп 2 гр. СЕРИЯ СИБИРСКИЕ ГИГАНТЫ!;29
"Серия ""Урожай на окне""";Горох Комнатный/Сем Алт/цп 10 гр. УРОЖАЙ НА ОКНЕ!;41
"Серия ""Урожай на окне""";Зелень Базилик Зеленый Ароматный/Сем Алт/цп 0,3 гр. УРОЖАЙ НА ОКНЕ!;28
"Серия ""Урожай на окне""";Зелень Базилик Мини/Сем Алт/цп 0,2 гр. УРОЖАЙ НА ОКНЕ!;29
"Серия ""Урожай на окне""";Зелень Базилик Ред Рубин/Сем Алт/цп 0,3 гр. УРОЖАЙ НА ОКНЕ!;28
"Серия ""Урожай на окне""";Зелень Кориандр Янтарь/Сем Алт/цп 2 гр. УРОЖАЙ НА ОКНЕ! !;24
"Серия ""Урожай на окне""";Зелень Шпинат Зимний Гигант/Сем Алт/цп 1 гр. УРОЖАЙ НА ОКНЕ!;24
"Серия ""Урожай на окне""";Лук на Зелень/Сем Алт/цп 0,5 гр. УРОЖАЙ НА ОКНЕ;29
"Серия ""Урожай на окне""";Огурец Городской Огурчик F1/Сем Алт/цп 5 шт. УРОЖАЙ НА ОКНЕ!;44
"Серия ""Урожай на окне""";Томат Золотце/Сем Алт/цп 0,05 гр. УРОЖАЙ НА ОКНЕ!;32
"Серия ""Урожай на окне""";Томат Кнопа/Сем Алт/цп 5 шт.;77
"Серия ""Урожай на окне""";Томат Комнатный Сибиряк/Сем Алт/цп 0,05 гр. УРОЖАЙ НА ОКНЕ!;32
"Серия ""Аптекарский огород""";Зелень Алтей Лекарственный/Сем Алт/цп 0,1 гр. АПТЕКАРСКИЙ ОГОРОД!;18
"Серия ""Аптекарский огород""";Зелень Валериана Кардиола лекарственная/Сем Алт/цп 0,1 гр.  АПТЕКАРСКИЙ ОГОРОД!;28
"Серия ""Аптекарский огород""";Зелень Девясил Много Сил/Сем Алт/цп 0,05 гр. АПТЕКАРСКИЙ ОГОРОД!;22
"Серия ""Аптекарский огород""";Зелень Зверобой Оптимист/Сем Алт/цп 0,1 гр. АПТЕКАРСКИЙ ОГОРОД!;29
"Серия ""Аптекарский огород""";Зелень Змееголовник Горыныч/Сем Алт/цп 0,3 гр. АПТЕКАРСКИЙ ОГОРОД!;20
"Серия ""Аптекарский огород""";Зелень Иссоп Знахарь лекарственный/Сем Алт/цп 0,2 гр. АПТЕКАРСКИЙ ОГОРОД!;27
"Серия ""Аптекарский огород""";Зелень Лофант Анисовый/Сем Алт/цп 0,05 гр. АПТЕКАРСКИЙ ОГОРОД!;19
"Серия ""Аптекарский огород""";Зелень Мелисса Лимонный Аромат/Сем Алт/цп 0,1 гр. АПТЕКАРСКИЙ ОГОРОД!;25
"Серия ""Аптекарский огород""";Зелень Мелисса Свежесть лекарственная/Сем Алт/цп 0,1 гр.;29
"Серия ""Аптекарский огород""";Зелень Мята Перечная Пепперминт/Сем Алт/цп 0,05 гр.АПТЕКАРСКИЙ ОГОРОД!;33
"Серия ""Аптекарский огород""";Зелень Мята Спирминт/Сем Алт/цп 0,05  гр.;33
"Серия ""Аптекарский огород""";Зелень Пажитник сенной Шамбала/Сем Алт/цп 0,5 гр. АПТЕКАРСКИЙ ОГОРОД!;28
"Серия ""Аптекарский огород""";Зелень Пажитник сенной Шамбала/Сем Алт/цп 1 гр. АПТЕКАРСКИЙ ОГОРОД!;29
"Серия ""Аптекарский огород""";Зелень Пустырник Сердечный/Сем Алт/цп 0,1 гр. АПТЕКАРСКИЙ ОГОРОД!;21
"Серия ""Аптекарский огород""";Зелень Расторопша пятнистая Здравница/Сем Алт/цп 1 гр. АПТЕКАРСКИЙ ОГОРОД!;18
"Серия ""Аптекарский огород""";Зелень Репешок обыкновенный/Сем Алт/цп 0,1 гр. АПТЕКАРСКИЙ ОГОРОД!;26
"Серия ""Аптекарский огород""";Зелень Ромашка Аптечная Айболит/Сем Алт/цп 0,2 гр. АПТЕКАРСКИЙ ОГОРОД!;24
"Серия ""Аптекарский огород""";Зелень Рута Кружевница/Сем Алт/цп 0,1 гр. АПТЕКАРСКИЙ ОГОРОД!;20
"Серия ""Аптекарский огород""";Зелень Стевия Медовая Трава/Сем Алт/цп 5 шт. АПТЕКАРСКИЙ ОГОРОД!;31
"Серия ""Аптекарский огород""";Зелень Тимьян Медок/Сем Алт/цп 0,2 гр. АПТЕКАРСКИЙ ОГОРОД!;32
"Серия ""Аптекарский огород""";Зелень Тысячелистник Волшебный Лекарь/Сем Алт/цп 0,1 гр. АПТЕКАРСКИЙ ОГОРОД!;26
"Серия ""Аптекарский огород""";Зелень Чернокорень Лекарственный/Сем Алт/цп 0,1 гр. АПТЕКАРСКИЙ ОГОРОД!;29
Аспарагус;Цветы Аспарагус Шпренггера/Сем Алт/цп 5 шт.;86
Бальзамин;Цветы Бальзамин Афина F1 Пурпурный букет/Сем Алт/цп 3 шт.;94
Бальзамин;Цветы Бальзамин Афина Красный букет/Сем Алт/цп 5 шт.;116
Бальзамин;Цветы Бальзамин Афина Пурпурный букет/Сем Алт/цп 5 шт.;116
Бальзамин;Цветы Бальзамин Беленс F1 Вайт/Сем Алт/цп 4 шт.;56
Бальзамин;Цветы Бальзамин Беленс F1 Виолет/Сем Алт/цп 4 шт.;64
Бальзамин;Цветы Бальзамин Беленс F1 Красная звезда/Сем Алт/цп 4 шт.;64
Бальзамин;Цветы Бальзамин Беленс F1 Красная звезда/Сем Алт/цп 5 шт. ГОЛЛАНДИЯ;65
