Категория;Наименование товара;Стоимость, руб
Арбуз;Арбуз Алый Сахар/Сем Алт/цп 1 гр.;29
Арбуз;Арбуз Астраханский/Сем Алт/цп 1 гр.;23
Арбуз;Арбуз АУ Продюсер ПВП/Сем Алт/цп 1 гр.;27
Арбуз;Арбуз Большой Сахарный/Сем Алт/цп 1 гр.;29
Арбуз;Арбуз Желтый Император/Сем Алт/цп 0,5 гр. АЗИАТСКИЙ ОГОРОД!;49
Арбуз;Арбуз Зелибоба/Сем Алт/цп 0,5 гр.;44
Арбуз;Арбуз Кримсон Свит/Сем Алт/цп 0,5 гр.;24
Арбуз;Арбуз Малиновый Сладкий/Сем Алт/цп 1 гр.;29
Арбуз;Арбуз Мелитопольский/Сем Алт/цп 0,5 гр.;23
Арбуз;Арбуз Ница/Сем Алт/цп 0,5 гр.;16
Арбуз;Арбуз Огонек/Сем Алт/цп 1 гр.;28
Арбуз;Арбуз Пекинский Нектар/Сем Алт/цп 0,5 гр.  АЗИАТСКИЙ ОГОРОД!;32
Арбуз;Арбуз Пекинский Нектар/Сем Алт/цп 1 гр. КИТАЙСКАЯ СЕРИЯ!;20
Арбуз;Арбуз Ранний Кубани/Сем Алт/цп 1 гр.;29
Арбуз;Арбуз Сахарная Вата/Сем Алт/цп 0,5 гр.;29
Арбуз;Арбуз Сахарная Вата/Сем Алт/цп 1 гр.;36
Арбуз;Арбуз Сахарный Малыш (Шуга Бейби)/Сем Алт/цп 1 гр.;29
Арбуз;Арбуз Сибирская Роза/Сем Алт/цп 1 гр.;28
Арбуз;Арбуз Сибирские Огни/Сем Алт/цп 1 гр. Сибирская Селекция!;29
Арбуз;Арбуз Сибирский Мед/Сем Алт/цп 1 гр.;29
Арбуз;Арбуз Ультраранний/Сем Алт/цп 1 гр.;32
Арбуз;Арбуз Фотон/Сем Алт/цп 1 гр.;23
Арбуз;Арбуз Холодок/Сем Алт/цп 1 гр.;29
Арбуз;Арбуз Чарльстон Грей/Сем Алт/цп 0,5 гр.;29
Арбуз;Арбуз Чарльстон Грей/Сем Алт/цп 1 гр.;34
Баклажан;Баклажан Алексеевский/Сем Алт/цп 0,1 гр.;44
Баклажан;Баклажан Аленка (Зеленый)/Сем Алт/цп 10 шт.;32
Баклажан;Баклажан Алмаз/Сем Алт/цп 0,1 гр.;25
Баклажан;Баклажан Брюнет/Сем Алт/цп 0,2 гр.;29
Баклажан;Баклажан Бычье Сердце/Сем Алт/цп 0,1 гр.;26
Баклажан;Баклажан Бычье Сердце/Сем Алт/цп 0,3 гр.;27
Баклажан;Баклажан Вера/Сем Алт/цп 0,3 гр. Сибирская Селекция!;26
Баклажан;Баклажан Икра Заморская/Сем Алт/цп 0,1 гр.;26
Баклажан;Баклажан Лебединый/Сем Алт/цп 0,1 гр.;41
Баклажан;Баклажан Лебединый/Сем Алт/цп 0,2 гр.;34
Баклажан;Баклажан Матроскин/Сем Алт/цп 0,2 гр.;29
Баклажан;Баклажан Северный Блюз F1/Сем Алт/цп 10 шт.;41
Баклажан;Баклажан Улыбка Негра/Сем Алт/цп 0,1 гр.;35
Баклажан;Баклажан Улыбка Негра/Сем Алт/цп 0,2 гр.;52
Баклажан;Баклажан Универсал-6/Сем Алт/цп 0,3 гр.;29
Баклажан;Баклажан Фиолетовый Длинный/Сем Алт/цп 0,1 гр.;26
Баклажан;Баклажан Фиолетовый Длинный/Сем Алт/цп 0,2 гр.;28
Баклажан;Баклажан Фрегат/Сем Алт/цп 0,2 гр.;25
Баклажан;Баклажан Черный Красавец/Сем Алт/цп 0,1 гр.;26
Баклажан;Баклажан Черный Красавец/Сем Алт/цп 0,2 гр.;27
Баклажан;Баклажан Черный Красавец/Сем Алт/цп 0,3 гр.;24
Баклажан;Баклажан Черный Опал/Сем Алт/цп 0,2 гр.;29
Баклажан;Баклажан Чисанчи/Сем Алт/цп 0,1 гр. АЗИАТСКИЙ ОГОРОД!;27
Баклажан;Баклажан Шаровидный/Сем Алт/цп 0,1 гр.;26
Баклажан;Баклажан Шаровидный/Сем Алт/цп 0,2 гр.;26
Баклажан;Баклажан Шаровидный/Сем Алт/цп 0,3 гр.;19
Баклажан;Баклажан Эпик F1/Сем Алт/цп 10 шт. Seminis (Голландские Семена);71
Баклажан;Баклажан Эфиоп/Сем Алт/цп 0,1 гр.;26
Баклажан;Баклажан Эфиоп/Сем Алт/цп 0,2 гр.;28
Брюква;Брюква Баварская/Сем Алт/цп 1 гр.;29
Брюква;Брюква Гера/Сем Алт/цп 0,5 гр. НОВИНКА!;24
Горох, бобы;Бобы Белорусские/Сем Алт/цп 5 гр.;29
Горох, бобы;Бобы Русские Черные/Сем Алт/цп 5 гр.;29
Горох, бобы;Горох Адагумский/Сем Алт/цп 10 гр.;18
Горох, бобы;Горох Алтайский Изумруд/Сем Алт/цп 10 гр. Сибирская Селекция!;26
Горох, бобы;Горох Альфа/Сем Алт/цп 10 гр.;26
Горох, бобы;Горох Амброзия/Сем Алт/цп 10 гр.;28
Горох, бобы;Горох Безлисточковый/Сем Алт/цп 10 гр.;26
Горох, бобы;Горох Беркут/Сем Алт/цп 10 гр.;27
Горох, бобы;Горох Воронежский зеленый/Сем Алт/цп 10 гр.;18
Горох, бобы;Горох Глориоза/Сем Алт/цп 10 гр.;26
Горох, бобы;Горох Жегалова 112 Сахарный/Сем Алт/цп 10 гр.;24
Горох, бобы;Горох Кельведонское Чудо/Сем Алт/цп 10 гр.;28
Горох, бобы;Горох Комнатный/Сем Алт/цп 10 гр. УРОЖАЙ НА ОКНЕ!;41
Горох, бобы;Горох Метеор/Сем Алт/цп 10 гр.;29
Горох, бобы;Горох Норд-Вест/Сем Алт/цп 10 гр.;23
Горох, бобы;Горох Орегон Шуга (Сахарный)/Сем Алт/цп 10 гр.;29
Горох, бобы;Горох Первенец Сахарный/Сем Алт/цп 10 гр.;29
Горох, бобы;Горох Сахарная Вкусняшка/Сем Алт/цп 10 гр.;29
Горох, бобы;Горох Сахарная Конфета/Сем Алт/цп 10 гр.;29
Горох, бобы;Горох Сахарный Стручок/Сем Алт/цп 10 гр.;29
Горох, бобы;Горох Сибирский Гигант/Сем Алт/цп 10 гр. СЕРИЯ СИБИРСКИЕ ГИГАНТЫ!;41
Горох, бобы;Горох Сладкая Парочка/Сем Алт/цп 10 гр.;29
Горох, бобы;Горох Сладкий Боб/Сем Алт/цп 10 гр.;29
Горох, бобы;Горох Спринтер/Сем Алт/цп 10 гр.;29
Горох, бобы;Горох Фуга/Сем Алт/цп 10 гр.;27
Горох, бобы;Горох Хавский Жемчуг/Сем Алт/цп 10 гр.;19
Горох, бобы;Горох Шесть недель/Сем Алт/цп 10 гр.;29
Горох, бобы;Чечевица Зеленая/Сем Алт/цп 5 гр.;32
Горох, бобы;Чечевица Коричневая/Сем Алт/цп 5 гр.;26
Дайкон;Дайкон Дубинушка/Сем Алт/цп 1 гр.;26
Дайкон;Дайкон Дядя Степа/Сем Алт/цп 1 гр.;26
Дайкон;Дайкон Зуб Акулы/Сем Алт/цп 1 гр.;27
Дайкон;Дайкон Миноваси/Сем Алт/цп 1 гр.;26
Дайкон;Дайкон Миясиге/Сем Алт/цп 1 гр. АЗИАТСКИЙ ОГОРОД!;26
Дайкон;Дайкон Самурай/Сем Алт/цп 1 гр. АЗИАТСКИЙ ОГОРОД!;26
Дайкон;Дайкон Саша/Сем Алт/цп 1 гр.;28
Дайкон;Дайкон Сибирский Гигант/Сем Алт/цп 1 гр. СЕРИЯ СИБИРСКИЕ ГИГАНТЫ!;30
Дайкон;Дайкон Цезарь/Сем Алт/цп 1 гр.;26
Дыня;Дыня Алтайская/Сем Алт/цп 0,5 гр.;27
Дыня;Дыня Ананас/Сем Алт/цп 0,5 гр.;29
Дыня;Дыня Ананас/Сем Алт/цп 1 гр.;35
Дыня;Дыня Восточная Красавица/Сем Алт/цп 0,5 гр.;27
Дыня;Дыня Восточная Красавица/Сем Алт/цп 1 гр.;39
Дыня;Дыня Золотистая/Сем Алт/цп 0,5 гр.;21
Дыня;Дыня Казачка 244/Сем Алт/цп 1 гр.;29
Дыня;Дыня Колхозница 749/753/Сем Алт/цп 1 гр.;27
Дыня;Дыня Крем-Брюле/Сем Алт/цп 1 гр.;29
Дыня;Дыня Медовая/Сем Алт/цп 0,5 гр.;29
Дыня;Дыня Медовый Месяц/Сем Алт/цп 0,5 гр.;29
Дыня;Дыня Нежная/Сем Алт/цп 0,5 гр.;29
Дыня;Дыня Птичье Молоко/Сем Алт/цп 1 гр.;29
Дыня;Дыня Сказка/Сем Алт/цп 1 гр.;28
Дыня;Дыня Сладкая Неженка/Сем Алт/цп 1 гр.;29
Дыня;Дыня Таманская (Ранняя 133)/Сем Алт/цп 1 гр.;29
Дыня;Дыня Шаранте/Сем Алт/цп 0,5 гр.;24
Дыня;Дыня Шаранте/Сем Алт/цп 1 гр.;30
Дыня;Дыня Шарлотта/Сем Алт/цп 0,5 гр. НОВИНКА!;23
Дыня;Дыня Эфиопка/Сем Алт/цп 1 гр.;29
Зелень;Зеленые Витамины для Грызунов/Сем Алт/цп 10 гр.;17
Зелень;Зеленые Витамины для любимых Кошек/Сем Алт/цп 10 гр.;23
Зелень;Зеленые Витамины для Пернатых/Сем Алт/цп 10 гр.;17
Зелень;Зелень Алтей Лекарственный/Сем Алт/цп 0,1 гр. АПТЕКАРСКИЙ ОГОРОД!;18
Зелень;Зелень Анис/Сем Алт/цп 0,5 гр.;18
Зелень;Зелень Артишок Красавец/Сем Алт/цп 0,5 гр.;33
Зелень;Зелень Артишок Римский/Сем Алт/цп 0.5 гр.;49
Зелень;Зелень Базилик Ароматная смесь/Сем Алт/цп 0,1 гр. НОВИНКА!;26
Зелень;Зелень Базилик Бархат/Сем Алт/цп 0,3 гр.;24
Зелень;Зелень Базилик Восточная Сказка/Сем Алт/цп 0,3 гр.;29
Зелень;Зелень Базилик Греческий/Сем Алт/цп 0,1 гр. НОВИНКА!;26
Зелень;Зелень Базилик Гурман/Сем Алт/цп 0,3 гр.;27
Зелень;Зелень Базилик Зеленый Ароматный/Сем Алт/цп 0,2 гр.;25
Зелень;Зелень Базилик Зеленый Ароматный/Сем Алт/цп 0,3 гр. УРОЖАЙ НА ОКНЕ!;28
Зелень;Зелень Базилик Лимонный Аромат/Сем Алт/цп 0,2 гр.;26
Зелень;Зелень Базилик Мини/Сем Алт/цп 0,2 гр. УРОЖАЙ НА ОКНЕ!;29
Зелень;Зелень Базилик Ред Рубин/Сем Алт/цп 0,2 гр.;26
Зелень;Зелень Базилик Ред Рубин/Сем Алт/цп 0,3 гр.;28
Зелень;Зелень Базилик Ред Рубин/Сем Алт/цп 0,3 гр. УРОЖАЙ НА ОКНЕ!;28
Зелень;Зелень Базилик Фиолетовый Арарат/Сем Алт/цп 0,2 гр.;26
Зелень;Зелень Базилик Фиолетовый Джигит/Сем Алт/цп 0,2 гр.;26
Зелень;Зелень Базилик Фиолетовый/Сем Алт/цп 0,2 гр.;26
Зелень;Зелень Базилик Фиолетовый/Сем Алт/цп 0,3 гр.;28
Зелень;Зелень Базилик Шанхай/Сем Алт/цп 0,3 гр. КИТАЙСКАЯ СЕРИЯ;23
Зелень;Зелень Базилик Широколистный/Сем Алт/цп 0,3 гр.;29
Зелень;Зелень Валериана Кардиола лекарственная/Сем Алт/цп 0,1 гр.  АПТЕКАРСКИЙ ОГОРОД!;28
Зелень;Зелень Горчица Листовая Волнушка/Сем Алт/цп 0,5 гр.;26
Зелень;Зелень Горчица Листовая/Сем Алт/цп 0,5 гр.;26
Зелень;Зелень Горчица Ядреная/Сем Алт/цп 0,5 гр.;29
Зелень;Зелень Девясил Много Сил/Сем Алт/цп 0,05 гр. АПТЕКАРСКИЙ ОГОРОД!;22
Зелень;Зелень Душица Обыкновенная/Сем Алт/цп 0,03 гр. АПТЕКАРСКИЙ ОГОРОД!;24
Зелень;Зелень Зверобой Оптимист/Сем Алт/цп 0,1 гр. АПТЕКАРСКИЙ ОГОРОД!;29
Зелень;Зелень Змееголовник Горыныч/Сем Алт/цп 0,3 гр. АПТЕКАРСКИЙ ОГОРОД!;20
Зелень;Зелень Иссоп Знахарь лекарственный/Сем Алт/цп 0,1 гр. АПТЕКАРСКИЙ ОГОРОД!;33
Зелень;Зелень Иссоп Знахарь лекарственный/Сем Алт/цп 0,2 гр. АПТЕКАРСКИЙ ОГОРОД!;27
Зелень;Зелень Катран (Хрен) Аккорд/Сем Алт/цп 0,3 гр.;27
Зелень;Зелень Катран (Хрен) Хренодер/Сем Алт/цп 0,3 гр. НОВИНКА!;27
Зелень;Зелень Кервель Ажурный/Сем Алт/цп 0,5 гр.;16
Зелень;Зелень Кориандр Бородинский/Сем Алт/цп 2 гр.;26
Зелень;Зелень Кориандр Летний Аромат/Сем Алт/цп 2 гр.;26
Зелень;Зелень Кориандр Янтарь/Сем Алт/цп 2 гр.;26
Зелень;Зелень Кориандр Янтарь/Сем Алт/цп 2 гр. УРОЖАЙ НА ОКНЕ! !;24
Зелень;Зелень Корн Салат Витаминные Листочки/Сем Алт/цп 0,5 гр.;26
Зелень;Зелень Корн Салат Кладезь Здоровья/Сем Алт/цп 0,5 гр.;24
Зелень;Зелень Кресс-Салат Ажур/Сем Алт/цп 1 гр.;18
Зелень;Зелень Кресс-Салат Забава/Сем Алт/цп 1 гр.;26
Зелень;Зелень Кумин (Зира) Восточная Долина/Сем Алт/цп 1 гр.;32
Зелень;Зелень Лаванда Нежность/Сем Алт/цп 0,1 гр. АПТЕКАРСКИЙ ОГОРОД!;29
Зелень;Зелень Лофант Анисовый/Сем Алт/цп 0,05 гр. АПТЕКАРСКИЙ ОГОРОД!;19
Зелень;Зелень Любисток Удалец/Сем Алт/цп 0,2 гр.;33
Зелень;Зелень Майоран Байкал/Сем Алт/цп 0,2 гр.;19
Зелень;Зелень Махорка Русская/Сем Алт/цп 0,01 гр. НОВИНКА!;26
Зелень;Зелень Мелисса Лимонный Аромат/Сем Алт/цп 0,1 гр. АПТЕКАРСКИЙ ОГОРОД!;25
Зелень;Зелень Мелисса Свежесть лекарственная/Сем Алт/цп 0,1 гр.;29
Зелень;Зелень Мята Перечная Пепперминт/Сем Алт/цп 0,05 гр.АПТЕКАРСКИЙ ОГОРОД!;33
Зелень;Зелень Мята Спирминт/Сем Алт/цп 0,05  гр.;33
Зелень;Зелень Огуречная Трава Гном/Сем Алт/цп 0,5 гр.;28
Зелень;Зелень Орегано Греческий/Сем Алт/цп 0,05 гр.;29
Зелень;Зелень Пажитник сенной Шамбала/Сем Алт/цп 0,5 гр. АПТЕКАРСКИЙ ОГОРОД!;28
Зелень;Зелень Пажитник сенной Шамбала/Сем Алт/цп 1 гр. АПТЕКАРСКИЙ ОГОРОД!;29
Зелень;Зелень Пастернак Кулинар/Сем Алт/цп 1 гр.;27
Зелень;Зелень Петрушка Корневая сахарная/Сем Алт/цп 2 гр.;27
Зелень;Зелень Петрушка Листовая Богатырь/Сем Алт/цп 2 гр.;28
Зелень;Зелень Петрушка Листовая Итальянский Гигант/Сем Алт/цп 2 гр.;27
Зелень;Зелень Петрушка Листовая Леди Лета/Сем Алт/цп 2 гр.;26
Зелень;Зелень Петрушка Листовая Обыкновенная/Сем Алт/цп 2 гр.;26
Зелень;Зелень Портулак Восточная Закуска огородный/Сем Алт/цп 0,1 гр.;26
Зелень;Зелень Пустырник Сердечный/Сем Алт/цп 0,1 гр. АПТЕКАРСКИЙ ОГОРОД!;21
Зелень;Зелень Расторопша пятнистая Здравница/Сем Алт/цп 1 гр. АПТЕКАРСКИЙ ОГОРОД!;18
Зелень;Зелень Ревень Виктория/Сем Алт/цп 0,1 гр.;27
Зелень;Зелень Репешок обыкновенный/Сем Алт/цп 0,1 гр. АПТЕКАРСКИЙ ОГОРОД!;26
Зелень;Зелень Розмарин Ароматный/Сем Алт/цп 0,03 гр.;44
Зелень;Зелень Ромашка Аптечная Айболит/Сем Алт/цп 0,2 гр. АПТЕКАРСКИЙ ОГОРОД!;24
Зелень;Зелень Рукола (Индау) Гурман/Сем Алт/цп 0,3 гр.;26
Зелень;Зелень Рукола (Индау) Итальяно/Сем Алт/цп 0,3 гр.;26
Зелень;Зелень Рукола (Индау) Сицилия/Сем Алт/цп 0,3 гр.;26
Зелень;Зелень Рута Кружевница/Сем Алт/цп 0,1 гр. АПТЕКАРСКИЙ ОГОРОД!;20
Зелень;Зелень Салат Азарт/Сем Алт/цп 0,5 гр.;26
Зелень;Зелень Салат Айсберг/Сем Алт/цп 0,5 гр.;29
Зелень;Зелень Салат Аттракцион/Сем Алт/цп 0,5 гр.;26
Зелень;Зелень Салат Берлинский Желтый/Сем Алт/цп 0,5 гр.;26
Зелень;Зелень Салат Великие Озера-659/Сем Алт/цп 0,5 гр.;29
Зелень;Зелень Салат Витаминный/Сем Алт/цп 0,5 гр.;26
Зелень;Зелень Салат Зайка-Зазнайка/Сем Алт/цп 0,5 гр.;29
Зелень;Зелень Салат Иван да Марья смесь/Сем Алт/цп 0,5 гр.;29
Зелень;Зелень Салат Изумрудное Кружево/Сем Алт/цп 0,5 гр.;29
Зелень;Зелень Салат Король Рынка/Сем Алт/цп 0,5 гр.;26
Зелень;Зелень Салат Кудрявый Мальчонка/Сем Алт/цп 0,5 гр.;29
Зелень;Зелень Салат Кучерявец Одесский/Сем Алт/цп 0,5 гр.;26
Зелень;Зелень Салат Лолло Бионда/Сем Алт/цп 0,5 гр.;29
Зелень;Зелень Салат Лолло Росса/Сем Алт/цп 0,5 гр.;29
Зелень;Зелень Салат Майский Король/Сем Алт/цп 0,5 гр.;26
Зелень;Зелень Салат Молодо-Зелено/Сем Алт/цп 0,5 гр.;29
Зелень;Зелень Салат Московский Парниковый/Сем Алт/цп 0,5 гр.;26
Зелень;Зелень Салат Парижский Флирт/Сем Алт/цп 0,5 гр.;19
Зелень;Зелень Салат Пармезан/Сем Алт/цп 0,01 гр, НОВИНКА!;71
Зелень;Зелень Салат Пекин/Сем Алт/цп 0,5 гр. АЗИАТСКИЙ ОГОРОД!;26
Зелень;Зелень Салат Пять Чудес Смесь/Сем Алт/цп БОЛЬШОЙ ПАКЕТ! НОВИНКА!;56
Зелень;Зелень Салат Светофор Смесь/Сем Алт/цп 0,5 гр. НОВИНКА!;29
Зелень;Зелень Салат Спаржевый Уйсун/Сем Алт/цп 0,5 гр. АЗИАТСКИЙ ОГОРОД!;28
Зелень;Зелень Салат Фриллис F1/Сем Алт/цп 0,01 гр. Seminis (Голландские Семена);72
Зелень;Зелень Салат Цикорий Витаминный Коктейль/Сем Алт/цп 0,5 гр.;26
Зелень;Зелень Салат Цикорий Витлуф/Сем Алт/цп 0,5 гр.;18
Зелень;Зелень Салат Цикорий каталонский Кружевные Узоры/Сем Алт/цп 0,5 гр.;26
Зелень;Зелень Салат Цикорий кочанный Диетический/Сем Алт/цп 0,5 гр.;24
Зелень;Зелень Салат Цикорий листовой Сахарные Листочки/Сем Алт/цп 0,5 гр.;18
Зелень;Зелень Салат Чудо 4 сезонов/Сем Алт/цп 0,5 гр.;26
Зелень;Зелень Салат Эндивий Кладезь Витаминов/Сем Алт/цп 0,5 гр.;18
Зелень;Зелень Салат Эндивий Рецепт Здоровья/Сем Алт/цп 0,5 гр.;24
Зелень;Зелень Салат Эндивий Целебный Букет/Сем Алт/цп 0,5 гр.;26
Зелень;Зелень Сельдерей Корневой Пражский Гигант/Сем Алт/цп 0,5  гр.;29
Зелень;Зелень Сельдерей Листовой Бодрость/Сем Алт/цп 0,5 гр.;26
Зелень;Зелень Сельдерей Черешковый Парус/Сем Алт/цп 0,5 гр.;29
Зелень;Зелень Скорцонера (Черный Корень) Лечебный/Сем Алт/цп 0,3 гр.;26
Зелень;Зелень Спаржа Аржентельская/Сем Алт/цп 0,5 гр.;41
Зелень;Зелень Стевия Медовая Трава/Сем Алт/цп 5 шт. АПТЕКАРСКИЙ ОГОРОД!;31
Зелень;Зелень Табак Берлей Краснодарский/Сем Алт/цп 0,01 гр.;27
Зелень;Зелень Табак Вирджиния 202 курительный/Сем Алт/цп 0,01 гр.;29
Зелень;Зелень Тимьян Медок/Сем Алт/цп 0,2 гр. АПТЕКАРСКИЙ ОГОРОД!;32
Зелень;Зелень Тмин Аппетитный/Сем Алт/цп 0,5 гр.;29
Зелень;Зелень Тысячелистник Волшебный Лекарь/Сем Алт/цп 0,1 гр. АПТЕКАРСКИЙ ОГОРОД!;26
Зелень;Зелень Укроп Аллигатор/Сем Алт/цп 2 гр.;28
Зелень;Зелень Укроп Грибовский/Сем Алт/цп 2 гр.;26
Зелень;Зелень Укроп Дондигидон/Сем Алт/цп 2 гр.;29
Зелень;Зелень Укроп Кибрай/Сем Алт/цп 2 гр.;23
Зелень;Зелень Укроп Кустистый/Сем Алт/цп 2 гр.;26
Зелень;Зелень Укроп Лесногородский/Сем Алт/цп 2 гр.;25
Зелень;Зелень Укроп Мамонт/Сем Алт/цп 2 гр.;26
Зелень;Зелень Укроп На Пучок/Сем Алт/цп 2 гр.;28
Зелень;Зелень Укроп Обильнолистный/Сем Алт/цп 2 гр.;25
Зелень;Зелень Укроп Салют/Сем Алт/цп 2 гр.;26
Зелень;Зелень Укроп Супердукат ОЕ/Сем Алт/цп 2 гр.;25
Зелень;Зелень Укроп Узоры/Сем Алт/цп 2 гр.;25
Зелень;Зелень Фенхель Удалец/Сем Алт/цп 0,5 гр.;26
Зелень;Зелень Чабер Ароматный/Сем Алт/цп 0,2 гр.;26
Зелень;Зелень Чабер Ароматный/Сем Алт/цп 0,5 гр.;26
Зелень;Зелень Чернокорень Лекарственный/Сем Алт/цп 0,1 гр. АПТЕКАРСКИЙ ОГОРОД!;29
Зелень;Зелень Шалфей Мускатный/Сем Алт/цп 0,1 гр.;26
Зелень;Зелень Шпинат Витаминный Король/Сем Алт/цп 1 гр.;26
Зелень;Зелень Шпинат Жирнолистный/Сем Алт/цп 1 гр.;26
Зелень;Зелень Шпинат Зимний Гигант/Сем Алт/цп 1 гр.;24
Зелень;Зелень Шпинат Зимний Гигант/Сем Алт/цп 1 гр. УРОЖАЙ НА ОКНЕ!;24
Зелень;Зелень Шпинат Матадор/Сем Алт/цп 1 гр.;24
Зелень;Зелень Шпинат Новозеландский/Сем Алт/цп 1 гр.;29
Зелень;Зелень Щавель Бабушкины Щи/Сем Алт/цп 0,5 гр.;26
Зелень;Зелень Щавель Бельвильский/Сем Алт/цп 0,5 гр.;26
Зелень;Зелень Щавель Кроваво-Красный/Сем Алт/цп 0,05 гр.;29
Зелень;Зелень Щавель Крупнолистный/Сем Алт/цп 0,5 гр.;26
Зелень;Зелень Щавель Широколистный/Сем Алт/цп 0,5 гр.;26
Зелень;Зелень Эстрагон Тархун/Сем Алт/цп 0,03 гр.;26
Зелень;Микрозелень Горох/Сем Алт/цп 10 гр.НОВИНКА! МИКРОЗЕЛЕНЬ!;24
