Категория;Наименование товара;Стоимость, руб
Бархатцы;Цветы Бархатцы Брокада смесь/Сем Алт/цп 0,2 гр.;29
Бархатцы;Цветы Бархатцы Веселые гномики махровые/Сем Алт/цп 0,2 гр. Ваш яркий балкон;26
Бархатцы;Цветы Бархатцы Веселый Клоун/Сем Алт/цп 0,3 гр.;29
Бархатцы;Цветы Бархатцы Высокорослая смесь/Сем Алт/цп 0,3 гр.;28
Бархатцы;Цветы Бархатцы Гавайи/Сем Алт/цп 0,2 гр.;28
Бархатцы;Цветы Бархатцы Желтая Брокада махровые/Сем Алт/цп 0,2 гр.;29
Бархатцы;Цветы Бархатцы Золотая Головка махровые/Сем Алт/цп 0,2 гр.;28
Бархатцы;Цветы Бархатцы Золотой Век низкорослые/Сем Алт/цп 0,1 гр.;29
Бархатцы;Цветы Бархатцы Золотой Самоцвет тонколистн./Сем Алт/цп 0,1 гр.;29
Бархатцы;Цветы Бархатцы Испанская Брокада махровые/Сем Алт/цп 0,2 гр. Ваш яркий балкон;29
Бархатцы;Цветы Бархатцы Кармен махровые/Сем Алт/цп 0,2 гр. Ваш яркий балкон;26
Бархатцы;Цветы Бархатцы Кармен махровые/Сем Алт/цп 0,3 гр. Ваш яркий балкон;27
Бархатцы;Цветы Бархатцы Килиманджаро/Сем Алт/цп 0,05 гр.;32
Бархатцы;Цветы Бархатцы Коландо смесь низкорослая/Сем Алт/цп 0,2 гр.;32
Бархатцы;Цветы Бархатцы Коландо/Сем Алт/цп 0,3 гр.;34
Бархатцы;Цветы Бархатцы Красная Брокада махровые/Сем Алт/цп 0,2 гр.;29
Бархатцы;Цветы Бархатцы Красная Вишня/Сем Алт/цп 0,2 гр.;29
Бархатцы;Цветы Бархатцы Красный Самоцвет тонколистн./Сем Алт/цп 0,1 гр.;29
Бархатцы;Цветы Бархатцы Креста Голд махровые/Сем Алт/цп 10 шт.;68
Бархатцы;Цветы Бархатцы Креста Голд махровые/Сем Алт/цп 5 шт.;56
Бархатцы;Цветы Бархатцы Креста Спрай махровые/Сем Алт/цп 10 шт.;68
Бархатцы;Цветы Бархатцы Лимонные Дольки махровые/Сем Алт/цп 0,2 гр.;28
Бархатцы;Цветы Бархатцы Лимонный принц/Сем Алт/цп 0,3 гр.;27
Бархатцы;Цветы Бархатцы Мандарин махровые/Сем Алт/цп 0,2 гр.;29
Бархатцы;Цветы Бархатцы Марвел F1 Желтые/Сем Алт/цп 5 шт.;74
Бархатцы;Цветы Бархатцы Марвел F1 Золотые/Сем Алт/цп 5 шт.;74
Бархатцы;Цветы Бархатцы Марвел F1 Оранжевые/Сем Алт/цп 5 шт.;74
Бархатцы;Цветы Бархатцы Марвел F1 Смесь/Сем Алт/цп 5 шт.;74
Бархатцы;Цветы Бархатцы Махровые Гиганты/Сем Алт/цп 0,2 гр.;28
Бархатцы;Цветы Бархатцы Мери Хелен/Сем Алт/цп 0,3 гр.;26
Бархатцы;Цветы Бархатцы Оранжевое пламя/Сем Алт/цп 0,2 гр.;28
Бархатцы;Цветы Бархатцы Оранжевый Принц/Сем Алт/цп 0,2 гр.;29
Бархатцы;Цветы Бархатцы Оранжевый Самоцвет тонколистн./Сем Алт/цп 0,1 гр.;29
Бархатцы;Цветы Бархатцы Отклоненные Смесь махровых сортов/Сем Алт/цп 0,2 гр.;27
Бархатцы;Цветы Бархатцы Петит Оранжевые махровые/Сем Алт/цп 0,2 гр.;29
Бархатцы;Цветы Бархатцы Петит Оранжевые махровые/Сем Алт/цп 0,3 гр.;26
Бархатцы;Цветы Бархатцы Петит Хармони махровые/Сем Алт/цп 0,3 гр.;29
Бархатцы;Цветы Бархатцы Примо Хармони карликовые/Сем Алт/цп 0,1 гр.;29
Бархатцы;Цветы Бархатцы Сиерра Желтые/Сем Алт/цп 0,2 гр.;27
Бархатцы;Цветы Бархатцы Сиерра Золотые/Сем Алт/цп 0,3 гр.;29
Бархатцы;Цветы Бархатцы Сиерра Оранжевые/Сем Алт/цп 0,3 гр.;29
Бархатцы;Цветы Бархатцы Сиерра Смесь/Сем Алт/цп 0,2 гр.;29
Бархатцы;Цветы Бархатцы Сиерра Смесь/Сем Алт/цп 0,3 гр.;31
Бархатцы;Цветы Бархатцы Скарлет София махровые/Сем Алт/цп 0,2 гр.;29
Бархатцы;Цветы Бархатцы Солнечные Гиганты/Сем Алт/цп 0,2 гр.;27
Бархатцы;Цветы Бархатцы Солнечные Зайчики/Сем Алт/цп 0,2 гр.;24
Бархатцы;Цветы Бархатцы Тайшан F1 Желтые/Сем Алт/цп 5 шт. Низкорослые гиганты;79
Бархатцы;Цветы Бархатцы Тайшан F1 Золотые/Сем Алт/цп 5 шт. Низкорослые гиганты;79
Бархатцы;Цветы Бархатцы Тайшан F1 Оранжевые/Сем Алт/цп 5 шт. Низкорослые гиганты;79
Бархатцы;Цветы Бархатцы Тайшан F1 Смесь/Сем Алт/цп 5 шт. Низкорослые гиганты;79
Бархатцы;Цветы Бархатцы Тигровые глаза/Сем Алт/цп 0,2 гр.;29
Бархатцы;Цветы Бархатцы Тигровые глаза/Сем Алт/цп 0,3 гр.;26
Бархатцы;Цветы Бархатцы Фантастика Желтые/Сем Алт/цп 0,2 гр.;35
Бархатцы;Цветы Бархатцы Фантастика Оранжевые/Сем Алт/цп 0,2 гр.;34
Бархатцы;Цветы Бархатцы Фантастика Смесь/Сем Алт/цп 0,2 гр.;35
Бархатцы;Цветы Бархатцы Френч Дварф Клубничный флирт/Сем Алт/цп 5 шт.;59
Бархатцы;Цветы Бархатцы Френч Дварф Огненный ковер/Сем Алт/цп 5 шт.;59
Бархатцы;Цветы Бархатцы Шаловливая Мариетта/Сем Алт/цп 0,2 гр. Ваш яркий балкон;29
Бархатцы;Цветы Бархатцы Шаловливая Мариетта/Сем Алт/цп 0,3 гр. Ваш яркий балкон;27
Василёк;Цветы Василек Блю Бол/Сем Алт/цп 0,3 гр.;29
Василёк;Цветы Василек Вайт Бол/Сем Алт/цп 0,3 гр.;27
Василёк;Цветы Василек Вайт Бол/Сем Алт/цп 0,5 гр.;26
Василёк;Цветы Василек Желтый Крупноголовый/Сем Алт/цп 0,2 гр. многолетник;34
Василёк;Цветы Василек Желтый Крупноголовый/Сем Алт/цп 0,3 гр. многолетник;34
Василёк;Цветы Василек Императорская Смесь мускусный/Сем Алт/цп 0,2 гр.;29
Василёк;Цветы Василек Императорская Смесь мускусный/Сем Алт/цп 0,3 гр.;26
Василёк;Цветы Василек Краски Лета смесь/Сем Алт/цп 0,3 гр.;27
Василёк;Цветы Василек Краски Лета смесь/Сем Алт/цп 0,5 гр.;28
Василёк;Цветы Василек Летние Каникулы смесь/Сем Алт/цп 0,3 гр.;27
Василёк;Цветы Василек Полька Дот/Сем Алт/цп 0,5 гр. низкорослый;28
Василёк;Цветы Василек Ред Бол/Сем Алт/цп 0,3 гр.;29
Василёк;Цветы Василек Флоренция низкорослый/Сем Алт/цп 0,2 гр.;29
Василёк;Цветы Василек Фрости Микс/Сем Алт/цп 0,2 гр.;26
Василёк;Цветы Василек Черный шар махровый/Сем Алт/цп 0,3 гр.;28
Василёк;Цветы Василек Ясная Поляна многолетний/Сем Алт/цп 0,2 гр. многолетник;41
Василёк;Цветы Василек Ясная Поляна многолетний/Сем Алт/цп 0,3 гр. многолетник;59
Вербена;Цветы Вербена Идеал гибридная/Сем Алт/цп 0,05 гр.;28
Вербена;Цветы Вербена Идеал гибридная/Сем Алт/цп 0,1гр.;29
Вербена;Цветы Вербена Триумф гибридная/Сем Алт/цп 0,05 гр.;28
Вербена;Цветы Вербена Тускани гибридная Синяя/Сем Алт/цп 4 шт. НОВИНКА;64
Вьюнок;Цветы Вьюнок Красный флаг трехцветный/Сем Алт/цп 0,5 гр. Ваш яркий балкон;29
Вьюнок;Цветы Вьюнок Синий флаг трехцветный/Сем Алт/цп 0,5 гр. Ваш яркий балкон;29
Вьюнок;Цветы Вьюнок Смесь окрасок трехцветный/Сем Алт/цп 0,5 гр. Ваш яркий балкон;24
Гацания;Цветы Гацания Новый день F1 Белая/Сем Алт/цп 5 шт. Низкорослые гиганты;79
Гацания;Цветы Гацания Новый день F1 Красная полоса/Сем Алт/цп 5 шт. Низкорослые гиганты;79
Гацания;Цветы Гацания Новый день F1 Оттенки красного/Сем Алт/цп 5 шт. Низкорослые гиганты;79
Гацания;Цветы Гацания Новый день F1 Оттенки розового/Сем Алт/цп 5 шт. Низкорослые гиганты;79
Гацания;Цветы Гацания Новый день F1 Розовая полоса/Сем Алт/цп 5 шт. Низкорослые гиганты;79
Гацания;Цветы Гацания Новый день Тигровая Смесь/Сем Алт/цп 5 шт. Низкорослые гиганты;79
Гацания;Цветы Гацания Сияние солнца/Сем Алт/цп 0,05 гр.;32
Гвоздика;Цветы Гвоздика гренадин Леди в красном/Сем Алт/цп 0,05 гр. двулетник;29
Гвоздика;Цветы Гвоздика Китайская Смесь окрасок/Сем Алт/цп 0,1 гр.;23
Гвоздика;Цветы Гвоздика Шабо Бенигна cадовая/Сем Алт/цп 0,1 гр.;29
Гвоздика;Цветы Гвоздика Шабо Смесь садовая/Сем Алт/цп 0,1 гр.;29
Гвоздика;Цветы Гвоздика Шабо Фантазия смесь садовая/Сем Алт/цп 0,05 гр.;27
Гелихризум;Цветы Гелихризум Королевский размер Смесь/Сем Алт/цп 0,1 гр. Сухоцветы;29
Гелихризум;Цветы Гелихризум Махровый Смесь/Сем Алт/цп 0,1 гр. Сухоцветы;29
Гелихризум;Цветы Гелихризум Том Тамб/Сем Алт/цп 0,1 Сухоцветы;27
Георгина;Цветы Георгина Веселые Ребята/Сем Алт/цп 0,2 гр.;29
Георгина;Цветы Георгина Декоративные гиганты/Сем Алт/цп 0,2 гр.;41
Георгина;Цветы Георгина Кактусовидная смесь/Сем Алт/цп 0,1гр.;29
Георгина;Цветы Георгина Коларет Денди/Сем Алт/цп 0,2 гр.;33
Георгина;Цветы Георгина Махровая смесь окрасок/Сем Алт/цп 0,2 гр.;29
Георгина;Цветы Георгина Мефистофель/Сем Алт/цп 0,2 гр.;29
Георгина;Цветы Георгина Монарх смесь полумахровая/Сем Алт/цп 0,2 гр.;29
Георгина;Цветы Георгина Отражение Нарцисса/Сем Алт/цп 0,2 гр.;29
Георгина;Цветы Георгина Помпонная смесь/Сем Алт/цп 0,2 гр.;36
Георгина;Цветы Георгина Радуга/Сем Алт/цп 0,2 гр.;29
Георгина;Цветы Георгина Ред Скайн Микс/Сем Алт/цп 0,2 гр.;34
Георгина;Цветы Георгина Фейерверк/Сем Алт/цп 0,2 гр.;66
Георгина;Цветы Георгина Фигаро Белая махровая/Сем Алт/цп 5 шт.;56
Георгина;Цветы Георгина Фигаро Красная махровая/Сем Алт/цп 5 шт.;56
Георгина;Цветы Георгина Фигаро Смесь махровая/Сем Алт/цп 5 шт.;64
Георгина;Цветы Георгина Экстрим/Сем Алт/цп 0,2 гр.;41
Годеция;Цветы Годеция Герцог Олбани/Сем Алт/цп 0,05 гр.;26
Годеция;Цветы Годеция Герцог Олбани/Сем Алт/цп 0,2 гр.;29
Годеция;Цветы Годеция Летний Рай/Сем Алт/цп 0,05 гр.;29
Годеция;Цветы Годеция Майден Блаш/Сем Алт/цп 0,2 гр.;29
Годеция;Цветы Годеция Махровые гиганты смесь/Сем Алт/цп 0,05 гр;28
Годеция;Цветы Годеция Метеор/Сем Алт/цп 0,05 гр.;27
Годеция;Цветы Годеция Метеор/Сем Алт/цп 0,2 гр.;29
Годеция;Цветы Годеция Монарх/Сем Алт/цп 0,05 гр. Ваш яркий балкон;27
Годеция;Цветы Годеция Сибил Шервуд/Сем Алт/цп 0,2 гр.;29
Душистый горошек;Цветы Душистый горошек Любящее сердце/Сем Алт/цп 0,5 низкорослый;36
Душистый горошек;Цветы Душистый горошек Роял Смесь/Сем Алт/цп 0,5 гр. Вьющиеся растения;29
Душистый горошек;Цветы Душистый горошек Спенсер смесь/Сем Алт/цп 0,5 гр. Вьющиеся растения;29
Иберис;Цветы Иберис Белый зонтичный/Сем Алт/цп 0,1 гр. Ароматы ночи;27
Иберис;Цветы Иберис Лилициана зонтичный/Сем Алт/цп 0,1 гр. Ароматы ночи;29
Иберис;Цветы Иберис Смесь Окрасок зонтичный/Сем Алт/цп 0,1 гр. Ароматы ночи;27
Иберис;Цветы Иберис Экспресс горький/Сем Алт/цп 0,1гр. Альпийская горка;28
Ипомея;Цветы Квамоклит Рубиновый ковер перистый/Сем Алт/цп 0,2 гр. Вьющиеся растения;27
Календула;Цветы Календула Абрикосовая красавица/Сем Алт/цп 0,3 гр.;27
Календула;Цветы Календула Абрикосовая красавица/Сем Алт/цп 0,5 гр.;29
Календула;Цветы Календула Бьюти Лемон пацифик/Сем Алт/цп 0,3 гр.;29
Календула;Цветы Календула Гейша/Сем Алт/цп 0,3 гр.;29
Календула;Цветы Календула Золотой Император махровая/Сем Алт/цп 0,3 гр.;26
Календула;Цветы Календула Индиан Принц/Сем Алт/цп 0,3 гр.;29
Календула;Цветы Календула Индиан Принц/Сем Алт/цп 0,5 гр.;27
Календула;Цветы Календула Каблуна Голд/Сем Алт/цп 0,5 гр. НОВИНКА;32
Календула;Цветы Календула Каблуна насыщенно-оранжевая/Сем Алт/цп 0,3 гр.;29
Календула;Цветы Календула Каблуна насыщенно-оранжевая/Сем Алт/цп 0,5 гр.;29
Календула;Цветы Календула Каблуна смесь/Сем Алт/цп 0,3 гр.;28
Календула;Цветы Календула Осенние краски/Сем Алт/цп 0,5 гр.;27
Календула;Цветы Календула Поцелуй бабочки махровая/Сем Алт/цп 0,3 гр.;29
Календула;Цветы Календула Розовый Сюрприз махровая/Сем Алт/цп 0,3 гр.;29
Календула;Цветы Календула Фиеста смесь низкор./Сем Алт/цп 0,5 гр.;29
Капуста декоративная;Цветы Капуста Декоративная Смесь окрасок/Сем Алт/цп 0,1 гр.;29
Капуста декоративная;Цветы Капуста Кондор F1 Белая декоративная/Сем Алт/цп 5 шт. НОВИНКА;90
Капуста декоративная;Цветы Капуста Кондор F1 Красная декоративная/Сем Алт/цп 5 шт. НОВИНКА;90
Капуста декоративная;Цветы Капуста Нагойя F1 Белая декоративная/Сем Алт/цп 10 шт.;79
Капуста декоративная;Цветы Капуста Нагойя F1 Красная декоративная/Сем Алт/цп 10 шт.;76
Капуста декоративная;Цветы Капуста Нагойя F1 Смесь декоративная/Сем Алт/цп 7 шт.;64
Капуста декоративная;Цветы Капуста Осака F1 Белая декоративная/Сем Алт/цп 10 шт.;72
Капуста декоративная;Цветы Капуста Осака F1 Красная декоративная/Сем Алт/цп 7 шт.;86
Катарантус;Цветы Катарантус Леденцы/Сем Алт/цп 0,05 гр.;29
Катарантус;Цветы Катарантус Средиземноморский Белый/Сем Алт/цп 5 шт. Ампельные Шедевры;71
Катарантус;Цветы Катарантус Средиземноморский Бургунди Хало/Сем Алт/цп 5 шт. Ампельные Шедевры;71
Катарантус;Цветы Катарантус Средиземноморский Красный/Сем Алт/цп 5 шт. Ампельные Шедевры;71
Катарантус;Цветы Катарантус Средиземноморский Смесь Эйфория/Сем Алт/цп 5 шт. Ампельные Шедевры;71
Катарантус;Цветы Катарантус Хит Вейв Бургунди/Сем Алт/цп 5 шт.;56
Катарантус;Цветы Катарантус Хит Вейв Пепперминт/Сем Алт/цп 5 шт.;56
Катарантус;Цветы Катарантус Хит Вейв Ред/Сем Алт/цп 5 шт.;56
Катарантус;Цветы Катарантус Хит Вейв Фулл микс/Сем Алт/цп 5 шт.;56
Катарантус;Цветы Катарантус Хит Вейв Эприкот/Сем Алт/цп 5 шт.;47
Кларкия, Клеома;Цветы Кларкия Смесь окрасок изящная/Сем Алт/цп 0,1 гр.;28
Кларкия, Клеома;Цветы Клеома Цветной фонтан/Сем Алт/цп 0,1 г Ароматы ночи;29
Космея, Космидиум;Цветы Космея Карнавал махровая/Сем Алт/цп 0,2 гр.;29
Космея, Космидиум;Цветы Космея Психе Махровая смесь/Сем Алт/цп 0,2 гр.;29
Космея, Космидиум;Цветы Космея Ракушка/Сем Алт/цп 0,3 гр.;29
Космея, Космидиум;Цветы Космея Ракушка/Сем Алт/цп 0,5 гр.;32
Космея, Космидиум;Цветы Космея Сенсация Кенди Страйп/Сем Алт/цп 0,3 гр.;29
Космея, Космидиум;Цветы Космея Сенсация/Сем Алт/цп 0,3 гр.;28
Космея, Космидиум;Цветы Космидиум Брюнет/Сем Алт/цп 0,01 гр.;26
Лаватера;Цветы Лаватера Красотка/Сем Алт/цп 0,2 гр.;29
Лаватера;Цветы Лаватера Мальвина смесь/Сем Алт/цп 0,2 гр.;29
Лаватера;Цветы Лаватера Монт Бланк/Сем Алт/цп 0,2 гр.;28
Лаватера;Цветы Лаватера Серебряная чаша/Сем Алт/цп 0,2 гр.;28
Лаватера;Цветы Лаватера Смесь Окрасок/Сем Алт/цп 0,2 гр;28
Левкой, Лен;Цветы Левкой Гигантская Смесь окрасок/Сем Алт/цп 0,1 гр.;29
Левкой, Лен;Цветы Левкой Гигантская Смесь окрасок/Сем Алт/цп 0,2 гр.;29
Левкой, Лен;Цветы Левкой Десятинедельный гном седой/Сем Алт/цп 0,05 гр.;28
Левкой, Лен;Цветы Левкой Кац Абрикосовое чудо махровый/Сем Алт/цп 8 шт.;60
Левкой, Лен;Цветы Левкой Кац Белое чудо махровый/Сем Алт/цп 8 шт. НОВИНКА;56
Левкой, Лен;Цветы Левкой Кац Розовое чудо махровый/Сем Алт/цп 8 шт.;56
Левкой, Лен;Цветы Левкой Кац Синее чудо махровый/Сем Алт/цп 8 шт. НОВИНКА;56
Левкой, Лен;Цветы Левкой Розовое Шампанское/Сем Алт/цп 0,03 гр.;29
Левкой, Лен;Цветы Левкой Розовое Шампанское/Сем Алт/цп 0,05 гр.;29
Левкой, Лен;Цветы Лен Красный/Сем Алт/цп 0,3 гр.;29
Левкой, Лен;Цветы Лен Небесная Лазурь/Сем Алт/цп 0,15 гр. многолетник;29
Левкой, Лен;Цветы Лен Смесь крупноцветковая/Сем Алт/цп 0,15 гр.;32
Левкой, Лен;Цветы Лен Смесь крупноцветковая/Сем Алт/цп 0,3 гр.;32
Левкой, Лен;Цветы Лен Яркие глазки крупноцветковый/Сем Алт/цп 0,15 гр.;32
Лобелия;Цветы Лобелия Белый Фонтан плетист./Сем Алт/цп 0,02 гр.;26
Лобелия;Цветы Лобелия Голубой Бриз длинночерешковая/Сем Алт/цп 0,02 гр.;29
Лобелия;Цветы Лобелия Голубой Фонтан плетист./Сем Алт/цп 0,02 гр.;26
Лобелия;Цветы Лобелия Красный Фонтан плетист./Сем Алт/цп 0,01 гр.;28
Лобелия;Цветы Лобелия Регатта Жемчужный Водопад ампельная/Сем Алт/цп 5 шт. Ампельные Шедевры;56
Лобелия;Цветы Лобелия Регатта Лиловый Водопад ампельная/Сем Алт/цп 5 шт. Ампельные Шедевры;56
Лобелия;Цветы Лобелия Регатта Миднайт Блю ампельная/Сем Алт/цп 5 шт. Ампельные Шедевры;56
Лобелия;Цветы Лобелия Регатта Розовый Водопад ампельная/Сем Алт/цп 5 шт. Ампельные Шедевры;56
Лобелия;Цветы Лобелия Регатта Скай блю ампельная/Сем Алт/цп 5 шт. Ампельные Шедевры;56
Лобелия;Цветы Лобелия Фонтан Cмесь плетист./Сем Алт/цп 0,02 гр. Ваш яркий балкон;29
Лобелия;Цветы Лобелия Эринус Белый Дворец/Сем Алт/цп 0,02 гр. Альпийская горка;27
Лобелия;Цветы Лобелия Эринус Хрустальный дворец/Сем Алт/цп 0,02 гр. Альпийская горка;26
Львиный зев;Цветы Львиный зев Античность F1 Красный/Сем Алт/цп 10 шт.;54
Львиный зев;Цветы Львиный зев Античность F1 Красный/Сем Алт/цп 7 шт.;49
Львиный зев;Цветы Львиный зев Античность F1 Оранж биколор/Сем Алт/цп 10 шт.;49
Львиный зев;Цветы Львиный зев Античность F1 Пурпурный/Сем Алт/цп 10 шт;56
Львиный зев;Цветы Львиный зев Античность F1 Пурпурный/Сем Алт/цп 7 шт.;56
Львиный зев;Цветы Львиный зев Белый Букет/Сем Алт/цп 0,1 гр.;29
