Категория;Наименование товара;Стоимость, руб
Бархатцы;Цветы Бархатцы Купид Золотисто-Желтые/Сем Алт/цп 0,3 гр.;44
Бархатцы;Цветы Бархатцы Лимонные Дольки махровые/Сем Алт/цп 0,2 гр.;37
Бархатцы;Цветы Бархатцы Лимонные Дольки махровые/Сем Алт/цп 0,3 гр.;36
Бархатцы;Цветы Бархатцы Лимонный принц/Сем Алт/цп 0,3 гр.;36
Бархатцы;Цветы Бархатцы Мандарин махровые/Сем Алт/цп 0,2 гр.;39
Бархатцы;Цветы Бархатцы Мандарин махровые/Сем Алт/цп 0,3 гр.;38
Бархатцы;Цветы Бархатцы Марвел F1 Желтые/Сем Алт/цп 5 шт.;98
Бархатцы;Цветы Бархатцы Марвел F1 Золотые/Сем Алт/цп 5 шт.;98
Бархатцы;Цветы Бархатцы Марвел F1 Оранжевые/Сем Алт/цп 5 шт.;98
Бархатцы;Цветы Бархатцы Марвел F1 Смесь/Сем Алт/цп 5 шт.;98
Бархатцы;Цветы Бархатцы Махровые Гиганты/Сем Алт/цп 0,2 гр.;37
Бархатцы;Цветы Бархатцы Махровые Гиганты/Сем Алт/цп 0,3 гр.;32
Бархатцы;Цветы Бархатцы Мери Хелен/Сем Алт/цп 0,3 гр.;34
Бархатцы;Цветы Бархатцы Оранжевый Принц/Сем Алт/цп 0,2 гр.;32
Бархатцы;Цветы Бархатцы Оранжевый Самоцвет тонколистн./Сем Алт/цп 0,1 гр.;38
Бархатцы;Цветы Бархатцы Отклоненные Смесь махровых сортов/Сем Алт/цп 0,2 гр.;36
Бархатцы;Цветы Бархатцы Отклоненные Смесь махровых сортов/Сем Алт/цп 0,3 гр.;35
Бархатцы;Цветы Бархатцы Петит Оранжевые махровые/Сем Алт/цп 0,2 гр.;39
Бархатцы;Цветы Бархатцы Петит Оранжевые махровые/Сем Алт/цп 0,3 гр.;34
Бархатцы;Цветы Бархатцы Петит Хармони махровые/Сем Алт/цп 0,3 гр.;34
Бархатцы;Цветы Бархатцы Примо Хармони карликовые/Сем Алт/цп 0,1 гр.;38
Бархатцы;Цветы Бархатцы Сиерра Желтые/Сем Алт/цп 0,2 гр.;36
Бархатцы;Цветы Бархатцы Сиерра Золотые/Сем Алт/цп 0,3 гр.;38
Бархатцы;Цветы Бархатцы Сиерра Оранжевые/Сем Алт/цп 0,3 гр.;38
Бархатцы;Цветы Бархатцы Сиерра Смесь/Сем Алт/цп 0,3 гр.;38
Бархатцы;Цветы Бархатцы Скарлет София махровые/Сем Алт/цп 0,2 гр.;39
Бархатцы;Цветы Бархатцы Солнечные Гиганты/Сем Алт/цп 0,2 гр.;37
Бархатцы;Цветы Бархатцы Солнечные Гиганты/Сем Алт/цп 0,3 гр.;32
Бархатцы;Цветы Бархатцы Солнечные Зайчики/Сем Алт/цп 0,2 гр.;32
Бархатцы;Цветы Бархатцы Тайшан F1 Желтые/Сем Алт/цп 5 шт. Низкорослые гиганты;105
Бархатцы;Цветы Бархатцы Тайшан F1 Золотые/Сем Алт/цп 5 шт. Низкорослые гиганты;105
Бархатцы;Цветы Бархатцы Тайшан F1 Оранжевые/Сем Алт/цп 5 шт. Низкорослые гиганты;105
Бархатцы;Цветы Бархатцы Тайшан F1 Смесь/Сем Алт/цп 5 шт. Низкорослые гиганты;105
Бархатцы;Цветы Бархатцы Тигровые глаза/Сем Алт/цп 0,2 гр.;37
Бархатцы;Цветы Бархатцы Тигровые глаза/Сем Алт/цп 0,3 гр.;34
Бархатцы;Цветы Бархатцы Фантастика Желтые/Сем Алт/цп 0,2 гр.;46
Бархатцы;Цветы Бархатцы Фантастика Оранжевые/Сем Алт/цп 0,2 гр.;45
Бархатцы;Цветы Бархатцы Фантастика Смесь/Сем Алт/цп 0,2 гр.;46
Бархатцы;Цветы Бархатцы Френч Дварф Клубничный флирт/Сем Алт/цп 5 шт.;78
Бархатцы;Цветы Бархатцы Френч Дварф Огненный ковер/Сем Алт/цп 5 шт.;78
Бархатцы;Цветы Бархатцы Шаловливая Мариетта/Сем Алт/цп 0,3 гр. Ваш яркий балкон;36
Василёк;Цветы Василек Блю Бол/Сем Алт/цп 0,3 гр.;38
Василёк;Цветы Василек Блю Бол/Сем Алт/цп 0,5 гр.;34
Василёк;Цветы Василек Вайт Бол/Сем Алт/цп 0,3 гр.;38
Василёк;Цветы Василек Вайт Бол/Сем Алт/цп 0,5 гр.;34
Василёк;Цветы Василек Желтый Крупноголовый/Сем Алт/цп 0,2 гр. многолетник;45
Василёк;Цветы Василек Желтый Крупноголовый/Сем Алт/цп 0,3 гр. многолетник;45
Василёк;Цветы Василек Императорская Смесь мускусный/Сем Алт/цп 0,3 гр.;34
Василёк;Цветы Василек Краски Лета смесь/Сем Алт/цп 0,3 гр.;36
Василёк;Цветы Василек Краски Лета смесь/Сем Алт/цп 0,5 гр.;37
Василёк;Цветы Василек Летние Каникулы смесь/Сем Алт/цп 0,3 гр.;35
Василёк;Цветы Василек Полька Дот/Сем Алт/цп 0,5 гр. низкорослый;37
Василёк;Цветы Василек Ред Бол/Сем Алт/цп 0,3 гр.;38
Василёк;Цветы Василек Флоренция низкорослый/Сем Алт/цп 0,2 гр.;38
Василёк;Цветы Василек Фрости Микс/Сем Алт/цп 0,2 гр.;35
Василёк;Цветы Василек Черный шар махровый/Сем Алт/цп 0,3 гр.;37
Василёк;Цветы Василек Ясная Поляна многолетний/Сем Алт/цп 0,3 гр. многолетник;78
Вербена;Цветы Вербена Идеал гибридная/Сем Алт/цп 0,05 гр.;37
Вербена;Цветы Вербена Идеал гибридная/Сем Алт/цп 0,1гр.;39
Вербена;Цветы Вербена Триумф гибридная/Сем Алт/цп 0,05 гр.;37
Вербена;Цветы Вербена Триумф гибридная/Сем Алт/цп 0,1 гр.;32
Вербена;Цветы Вербена Тускани гибридная Синяя/Сем Алт/цп 4 шт. НОВИНКА;85
Вербена;Цветы Вербена Финесс Апекс бонарская/Сем Алт/цп 5 шт. НОВИНКА;85
Вьюнок;Цветы Вьюнок Красный флаг трехцветный/Сем Алт/цп 0,5 гр. Ваш яркий балкон;38
Вьюнок;Цветы Вьюнок Синий флаг трехцветный/Сем Алт/цп 0,5 гр. Ваш яркий балкон;38
Вьюнок;Цветы Вьюнок Смесь окрасок трехцветный/Сем Алт/цп 0,5 гр. Ваш яркий балкон;32
Гацания;Цветы Гацания Новый день F1 Белая/Сем Алт/цп 5 шт. Низкорослые гиганты;105
Гацания;Цветы Гацания Новый день F1 Красная полоса/Сем Алт/цп 5 шт. Низкорослые гиганты;105
Гацания;Цветы Гацания Новый день F1 Оттенки красного/Сем Алт/цп 5 шт. Низкорослые гиганты;105
Гацания;Цветы Гацания Новый день F1 Оттенки розового/Сем Алт/цп 5 шт. Низкорослые гиганты;105
Гацания;Цветы Гацания Новый день F1 Розовая полоса/Сем Алт/цп 5 шт. Низкорослые гиганты;105
Гацания;Цветы Гацания Новый день Тигровая Смесь/Сем Алт/цп 5 шт. Низкорослые гиганты;105
Гвоздика;Цветы Гвоздика Китайская Смесь окрасок/Сем Алт/цп 0,1 гр.;30
Гвоздика;Цветы Гвоздика Шабо Бенигна cадовая/Сем Алт/цп 0,1 гр.;39
Гвоздика;Цветы Гвоздика Шабо Смесь садовая/Сем Алт/цп 0,1 гр.;38
Гвоздика;Цветы Гвоздика Шабо Фантазия смесь садовая/Сем Алт/цп 0,05 гр.;36
Гвоздика;Цветы Гвоздика Шабо Фантазия смесь/Сем Алт/цп 0,1 гр.;38
Гелихризум;Цветы Гелихризум Королевский размер Смесь/Сем Алт/цп 0,1 гр. Сухоцветы;39
Гелихризум;Цветы Гелихризум Махровый Смесь/Сем Алт/цп 0,1 гр. Сухоцветы;39
Гелихризум;Цветы Гелихризум Том Тамб/Сем Алт/цп 0,2;39
Георгина;Цветы Георгина Веселые Ребята/Сем Алт/цп 0,2 гр.;39
Георгина;Цветы Георгина Декоративные гиганты/Сем Алт/цп 0,2 гр.;50
Георгина;Цветы Георгина Кактусовидная смесь/Сем Алт/цп 0,1гр.;38
Георгина;Цветы Георгина Коларет Денди/Сем Алт/цп 0,3 гр.;49
Георгина;Цветы Георгина Отражение Нарцисса/Сем Алт/цп 0,2 гр.;39
Георгина;Цветы Георгина Помпонная смесь/Сем Алт/цп 0,2 гр.;48
Георгина;Цветы Георгина Радуга/Сем Алт/цп 0,2 гр.;38
Георгина;Цветы Георгина Фейерверк/Сем Алт/цп 0,2 гр.;88
Георгина;Цветы Георгина Фигаро Белая махровая/Сем Алт/цп 5 шт.;85
Георгина;Цветы Георгина Фигаро Красная махровая/Сем Алт/цп 5 шт.;85
Георгина;Цветы Георгина Фигаро Смесь махровая/Сем Алт/цп 5 шт.;85
Георгина;Цветы Георгина Фигаро Фиолетовая махровая/Сем Алт/цп 5 шт.;85
Георгина;Цветы Георгина Экстрим/Сем Алт/цп 0,2 гр.;55
Годеция;Цветы Годеция Герцог Олбани/Сем Алт/цп 0,05 гр.;35
Годеция;Цветы Годеция Герцог Олбани/Сем Алт/цп 0,2 гр. НОВИНКА;39
Годеция;Цветы Годеция Летний Рай/Сем Алт/цп 0,05 гр.;39
Годеция;Цветы Годеция Майден Блаш/Сем Алт/цп 0,2 гр.;39
Годеция;Цветы Годеция Махровые гиганты смесь/Сем Алт/цп 0,05 гр;37
Годеция;Цветы Годеция Метеор/Сем Алт/цп 0,05 гр.;37
Годеция;Цветы Годеция Метеор/Сем Алт/цп 0,2 гр.;39
Годеция;Цветы Годеция Монарх/Сем Алт/цп 0,05 гр. Ваш яркий балкон;37
Годеция;Цветы Годеция Рембрандт/Сем Алт/цп 0,2 гр. Ваш яркий балкон;39
Годеция;Цветы Годеция Сибил Шервуд/Сем Алт/цп 0,2 гр.;39
Душистый горошек;Цветы Душистый горошек Любящее сердце/Сем Алт/цп 0,5 низкорослый;48
Душистый горошек;Цветы Душистый горошек Роял Смесь/Сем Алт/цп 0,5 гр. Вьющиеся растения;39
Душистый горошек;Цветы Душистый горошек Спенсер смесь/Сем Алт/цп 0,5 гр. Вьющиеся растения;36
Иберис;Цветы Иберис Белый зонтичный/Сем Алт/цп 0,3 гр. Ароматы ночи;39
Иберис;Цветы Иберис Лилициана зонтичный/Сем Алт/цп 0,1 гр. Ароматы ночи;38
Иберис;Цветы Иберис Смесь Окрасок зонтичный/Сем Алт/цп 0,1 гр. Ароматы ночи;37
Иберис;Цветы Иберис Экспресс горький/Сем Алт/цп 0,1гр. Альпийская горка;37
Ипомея;Цветы Квамоклит Рубиновый ковер перистый/Сем Алт/цп 0,2 гр. Вьющиеся растения;36
Календула;Цветы Календула Абрикосовая красавица/Сем Алт/цп 0,3 гр.;36
Календула;Цветы Календула Абрикосовая красавица/Сем Алт/цп 0,5 гр.;38
Календула;Цветы Календула Бьюти Лемон пацифик/Сем Алт/цп 0,3 гр.;32
Календула;Цветы Календула Гейша/Сем Алт/цп 0,3 гр.;38
Календула;Цветы Календула Золотой Император махровая/Сем Алт/цп 0,3 гр.;35
Календула;Цветы Календула Индиан Принц/Сем Алт/цп 0,5 гр.;36
Календула;Цветы Календула Каблуна Голд/Сем Алт/цп 0,5 гр. НОВИНКА;42
Календула;Цветы Календула Каблуна насыщенно-оранжевая/Сем Алт/цп 0,5 гр.;39
Календула;Цветы Календула Каблуна смесь/Сем Алт/цп 0,3 гр.;37
Календула;Цветы Календула Каблуна смесь/Сем Алт/цп 0,5 гр.;36
Календула;Цветы Календула Осенние краски/Сем Алт/цп 0,5 гр.;36
Календула;Цветы Календула Поцелуй бабочки махровая/Сем Алт/цп 0,3 гр.;39
Календула;Цветы Календула Поцелуй бабочки махровая/Сем Алт/цп 0,5 гр.;36
Календула;Цветы Календула Розовый Сюрприз махровая/Сем Алт/цп 0,3 гр.;39
Календула;Цветы Календула Розовый Сюрприз махровая/Сем Алт/цп 0,5 гр.;36
Календула;Цветы Календула Фиеста смесь низкор./Сем Алт/цп 0,5 гр.;38
Капуста декоративная;Цветы Капуста Декоративная Смесь окрасок/Сем Алт/цп 0,1 гр.;37
Капуста декоративная;Цветы Капуста Кондор F1 Белая декоративная/Сем Алт/цп 5 шт. НОВИНКА;120
Капуста декоративная;Цветы Капуста Кондор F1 Красная декоративная/Сем Алт/цп 5 шт. НОВИНКА;120
Капуста декоративная;Цветы Капуста Нагойя F1 Белая декоративная/Сем Алт/цп 10 шт.;105
Капуста декоративная;Цветы Капуста Нагойя F1 Красная декоративная/Сем Алт/цп 10 шт.;101
Капуста декоративная;Цветы Капуста Нагойя F1 Смесь декоративная/Сем Алт/цп 7 шт.;85
Капуста декоративная;Цветы Капуста Осака F1 Белая декоративная/Сем Алт/цп 10 шт.;96
Капуста декоративная;Цветы Капуста Осака F1 Красная декоративная/Сем Алт/цп 7 шт.;115
Катарантус;Цветы Катарантус Леденцы/Сем Алт/цп 0,05 гр.;38
Катарантус;Цветы Катарантус Средиземноморский Белый/Сем Алт/цп 5 шт. Ампельные Шедевры;95
Катарантус;Цветы Катарантус Средиземноморский Бургунди Хало/Сем Алт/цп 5 шт. Ампельные Шедевры;95
Катарантус;Цветы Катарантус Средиземноморский Красный/Сем Алт/цп 5 шт. Ампельные Шедевры;95
Катарантус;Цветы Катарантус Средиземноморский Смесь Эйфория/Сем Алт/цп 5 шт. Ампельные Шедевры;95
Катарантус;Цветы Катарантус Хит Вейв Бургунди/Сем Алт/цп 5 шт.;62
Катарантус;Цветы Катарантус Хит Вейв Пепперминт/Сем Алт/цп 5 шт.;62
Катарантус;Цветы Катарантус Хит Вейв Ред/Сем Алт/цп 5 шт.;62
Катарантус;Цветы Катарантус Хит Вейв Фулл микс/Сем Алт/цп 5 шт.;62
Катарантус;Цветы Катарантус Хит Вейв Эприкот/Сем Алт/цп 5 шт.;62
Кларкия, Клеома;Цветы Кларкия Смесь окрасок изящная/Сем Алт/цп 0,1 гр.;37
Кларкия, Клеома;Цветы Клеома Цветной фонтан/Сем Алт/цп 0,1 г Ароматы ночи;38
Космея, Космидиум;Цветы Космея Карнавал махровая/Сем Алт/цп 0,2 гр.;38
Космея, Космидиум;Цветы Космея Психе Махровая смесь/Сем Алт/цп 0,2 гр.;38
Космея, Космидиум;Цветы Космея Ракушка/Сем Алт/цп 0,5 гр.;42
Космея, Космидиум;Цветы Космея Сенсация Кенди Страйп/Сем Алт/цп 0,3 гр.;39
Космея, Космидиум;Цветы Космея Сенсация Кенди Страйп/Сем Алт/цп 0,5 гр.;37
Космея, Космидиум;Цветы Космея Сенсация/Сем Алт/цп 0,3 гр.;37
Космея, Космидиум;Цветы Космидиум Брюнет/Сем Алт/цп 0,01 гр.;28
Лаватера;Цветы Лаватера Красотка/Сем Алт/цп 0,2 гр.;37
Лаватера;Цветы Лаватера Мальвина смесь/Сем Алт/цп 0,2 гр.;37
Лаватера;Цветы Лаватера Монт Бланк/Сем Алт/цп 0,2 гр.;37
Лаватера;Цветы Лаватера Серебряная чаша/Сем Алт/цп 0,2 гр.;37
Лаватера;Цветы Лаватера Смесь Окрасок/Сем Алт/цп 0,2 гр;37
Левкой, Лен;Цветы Левкой Гигантская Смесь окрасок/Сем Алт/цп 0,2 гр.;38
Левкой, Лен;Цветы Левкой Десятинедельный гном седой/Сем Алт/цп 0,05 гр.;37
Левкой, Лен;Цветы Левкой Десятинедельный гном седой/Сем Алт/цп 0,1 гр.;34
Левкой, Лен;Цветы Левкой Кац Абрикосовое чудо махровый/Сем Алт/цп 8 шт.;80
Левкой, Лен;Цветы Левкой Кац Белое чудо махровый/Сем Алт/цп 8 шт. НОВИНКА;75
Левкой, Лен;Цветы Левкой Кац Розовое чудо махровый/Сем Алт/цп 8 шт.;75
Левкой, Лен;Цветы Левкой Кац Синее чудо махровый/Сем Алт/цп 8 шт. НОВИНКА;75
Левкой, Лен;Цветы Левкой Розовое Шампанское/Сем Алт/цп 0,05 гр.;38
Левкой, Лен;Цветы Лен Красный/Сем Алт/цп 0,3 гр.;38
Левкой, Лен;Цветы Лен Небесная Лазурь/Сем Алт/цп 0,15 гр. многолетник;38
Левкой, Лен;Цветы Лен Смесь крупноцветковая/Сем Алт/цп 0,15 гр.;42
Левкой, Лен;Цветы Лен Смесь крупноцветковая/Сем Алт/цп 0,3 гр.;42
Левкой, Лен;Цветы Лен Яркие глазки крупноцветковый/Сем Алт/цп 0,15 гр.;42
Лобелия;Цветы Лобелия Белый Фонтан плетист./Сем Алт/цп 0,02 гр.;34
Лобелия;Цветы Лобелия Голубой Бриз длинночерешковая/Сем Алт/цп 0,02 гр.;38
Лобелия;Цветы Лобелия Голубой Фонтан плетист./Сем Алт/цп 0,02 гр.;35
Лобелия;Цветы Лобелия Красный Фонтан плетист./Сем Алт/цп 0,01 гр.;37
Лобелия;Цветы Лобелия Регатта Жемчужный Водопад ампельная/Сем Алт/цп 5 шт. Ампельные Шедевры;75
Лобелия;Цветы Лобелия Регатта Лиловый Водопад ампельная/Сем Алт/цп 5 шт. Ампельные Шедевры;75
Лобелия;Цветы Лобелия Регатта Миднайт Блю ампельная/Сем Алт/цп 5 шт. Ампельные Шедевры;75
Лобелия;Цветы Лобелия Регатта Розовый Водопад ампельная/Сем Алт/цп 5 шт. Ампельные Шедевры;75
Лобелия;Цветы Лобелия Регатта Скай блю ампельная/Сем Алт/цп 5 шт. Ампельные Шедевры;75
Лобелия;Цветы Лобелия Фонтан Cмесь плетист./Сем Алт/цп 0,02 гр. Ваш яркий балкон;34
Лобелия;Цветы Лобелия Эринус Белый Дворец/Сем Алт/цп 0,02 гр. Альпийская горка;36
Лобелия;Цветы Лобелия Эринус Хрустальный дворец/Сем Алт/цп 0,02 гр. Альпийская горка;34
Львиный зев;Цветы Львиный зев Античность F1 Красный/Сем Алт/цп 10 шт.;72
Львиный зев;Цветы Львиный зев Античность F1 Оранж биколор/Сем Алт/цп 10 шт.;78
Львиный зев;Цветы Львиный зев Античность F1 Пурпурный/Сем Алт/цп 7 шт.;75
Львиный зев;Цветы Львиный зев Античность Пурпурный/Сем Алт/цп 10 шт;75
Львиный зев;Цветы Львиный зев Белый Букет/Сем Алт/цп 0,1 гр.;39
Львиный зев;Цветы Львиный зев Бразильский карнавал/Сем Алт/цп 0,2 гр.;38
Львиный зев;Цветы Львиный зев Гигантская смесь/Сем Алт/цп 0,2 гр.;38
Львиный зев;Цветы Львиный зев Магический Ковер/Сем Алт/цп 0,2 гр.;38
Львиный зев;Цветы Львиный зев Рубиново-красный букет/Сем Алт/цп 0,2 гр.;44
Львиный зев;Цветы Львиный зев Снэппи Бронзовый закат/Сем Алт/цп 7 шт.;75
Львиный зев;Цветы Львиный зев Снэппи Лимонный фреш/Сем Алт/цп 7 шт.;77
Львиный зев;Цветы Львиный зев Снэппи Пламенная орхидея/Сем Алт/цп 7 шт.;77
Львиный зев;Цветы Львиный зев Снэппи Розовый фламинго/Сем Алт/цп 7 шт.;77
Львиный зев;Цветы Львиный зев Снэппи Скарлет/Сем Алт/цп 7 шт.;77
Львиный зев;Цветы Львиный зев Снэппи Триколор микс/Сем Алт/цп 7 шт.;75
Львиный зев;Цветы Львиный зев Твинни F1 Фиолетовый Махровый/Сем Алт/цп 5 шт.;85
Львиный зев;Цветы Львиный зев Твинни Белый Махровый/Сем Алт/цп 10 шт;112
Львиный зев;Цветы Львиный зев Тетра Смесь/Сем Алт/цп 0,1 гр.;42
Львиный зев;Цветы Львиный зев Тетра Смесь/Сем Алт/цп 0,2 гр.;44
Львиный зев;Цветы Львиный зев Том Тамб Карликовый/Сем Алт/цп 0,1гр;39
Львиный зев;Цветы Львиный зев Фейерверк F1 белый ампельный/Сем Алт/цп 5 шт. Ампельные шедевры;95
Львиный зев;Цветы Львиный зев Фейерверк F1 желтый ампельный/Сем Алт/цп 5 шт. Ампельные шедевры;95
Львиный зев;Цветы Львиный зев Фейерверк F1 оранжевый ампельный/Сем Алт/цп 3 шт. Ампельные шедевры;185
Львиный зев;Цветы Львиный зев Фейерверк F1 оранжевый ампельный/Сем Алт/цп 5 шт. Ампельные шедевры;95
